Domain,Content
http://www.foxwoods.com,deluxe casino shopping resort meetingluxury wide dining pequotledyard vacationsbusiness ct lodgingaccommodationsaccomodationsspasuitesvacationgetawaysdiscountroomsarea foxwoods fine variety ctfamily accommodations connecticut entertainment travelromantic features getawayreservationsgolfbest attractions casinosresortshotelsmashantucket
http://www.igbaffiliate.com,igb business affiliate conferences industry publishes magazine operates igaming
http://www.atlus.com,including persona odyssey website usa information shin homepage tensei etrian receive series titles atlus uptodate official megami game
http://www.sudoku.name,meet puzzle free players levels sudoku get unlimited choose print play online statistics share games puzzles difficulty
http://www.nintendo.com.au,stackpath
http://www.gameservers.com,ventrilo host servers clan hosting game teamspeak server dedicated
http://www.videogamer.com,console source videogamercom pc ps reviews one videos trailers video news xbox game
http://www.wordsolver.net,turn bogglelike rearranges letters scrabble boggle pics although something even wordladder wordsolver anagrambased word anagram words draw grid help friends crosswords solver helps games
http://www.desmume.org,desmume
http://www.arcade-museum.com,fortune coinoperated stimulators atari vaps videogames resource videogame redemption iam covering klov music centuri premier tellers arcade scales worlds jukeboxes sega supply vending antique pinball game amusement arcadia machine trade musuem video device museum mills international midway coinop penny exhibit konami bally history games machines
http://www.holdemmanager.com,information analyzing display tool visual official game table opponents new poker manager page help identify heads provides users hm holdem
http://www.michiganlottery.com,powerball homepage fantasy jackpots michigan mega online website buy view official instant millions winning current hour lottery twentyfour lotto games numbers
http://www.aiononline.com,
http://www.spring4sims.com,sims downloads custom free updates daily springsims since best updated cc content finds
http://www.palacasino.com,forbidden
http://www.lineage.pmfun.com,interlude goddess destruction drop calculator quest five gracia kamael l hellbound high c spoil interludekamaelhellboundgraciafreyahigod freya lineage game
http://www.projectzomboid.com,ultimate survival zombie rpg
http://www.indiarace.com,first foremost racing horse portal indiaracecom indias
http://www.renpy.org,engine visual novel renpy
http://www.majornelson.com,lives homepage nelson major xbox
http://www.renai.us,archive renai
http://www.sclv.com,resorts las vegas hotels station casinos
http://www.simtropolis.com,custom journals simcity forum online downloads discussion community simtropoliscom reference skylines mod game city help cities guides forums sc tutorials addons walkthroughs articles featuring citybuilding mods
http://www.flightsim.com,home ultimate searchable galleries flightsimcom xplane downloads site fsx thousands flight microsoft pilots simulation fs file tips aviation flying download prepard forums message pc addons photo flightsim simulator files
http://www.pickuphockey.com,pool ultimate fantasy set pick online news pickem community pools fully officepools hockey pickup free nhl manager forums pickuphockey easy office customizable
http://www.nostalrius.org,nostalrius begins
http://www.openttd.org,openttd home
http://www.funjoint.com,acceptable
http://www.mnlottery.com,lottery homepage home minnesota
http://www.247freepoker.com,wild many tens free casino chips poker better deuces play joker online download video games jacks game
http://www.warcraftpets.com,wow battle companions warcraftpetscom vanity pets
http://www.theminiaturespage.com,armintrout tmp fantasy devoted historical scales soldiers wargame fiction miniatures magazine game etc toy genres miniature page science web bill wargaming soldier history games
http://www.take2games.com,interactive taketwo
http://www.atariage.com,pictures guide nexus atari played rarity board videogames roms videogame emulation jaguar bit much news bushnell discussion links atariage scans buy st worth hasbro falcon jts collect game boxes boards manuals stella sale scan labels infogrames download video guides message collecting value database nolan today storing articles history rom games lynx price vcs
http://www.clubwpt.com,events brought clubwpt main live vip online cash every k play share chance official real game poker world wpt including day tournaments tour prizes monthly packages
http://www.gamesalad.com,gamesalad home
http://www.seventhsanctum.com,descriptions art randomly produce sanctum creativity site rpg alleviate characters creative generators inspiration seventh roleplaying page welcome fun stories concepts well blocks games writing
http://www.sportsinsights.com,insights trends industrys forces odds move live visit bets site ncaab lines platform sports nfl help betting analytics make smarter mlb advanced today track nba ncaaf
http://www.team-dignitas.net,dignitas
http://www.gametabs.net,tabs video tablature game
http://www.crosswordsolver.org,australia letters missing uk forum solves finish search puzzles letter millions used help database clues usa clue solver crossword
http://www.cgmagonline.com,cgmagazine gaming conversation reviews looking features culture art editorials articles comics build helps interviews magazine insightful news
http://www.psypokes.com,pokémon connection psychic psypoke
http://www.elitedangerous.com,dangerous take starship galaxy elite control
http://www.runehq.com,many awarded trail community one databases shop jagex rs tips unfair quest treasure help runescape forums guides helpful stop advantage monster runehq platinum features walkthrough everything
http://www.mmorpg-life.com,lifestyle life news mmorpg lifemmorpg guides
http://www.warcraftmovies.com,moment
http://www.starmen.net,mother goodness starmennet earthbound
http://www.darkageofcamelot.com,falls shrouded age winning skill combinations darkness rising df hibernia daoc mythic features comprehensive midgard trade war rvr system toa camelot mmorpg catacombs trials combat featuring guild labyrinth play robust classrace realms player rpg award mmo foundations dark bioware multiple atlantis realm albion frontiers isles herald pvp focused vs ea minotaur three
http://www.aq3d.com,friends action video ios world greatest home device game worlds mmorpg play legendary anywhere explore incredible filled crossplatform steam quest multiplayer online loot expanding adventure android ever massively fantasy monsters high
http://www.rpgfan.com,rpg reviews extensive rpgfan coverage since games news rpgs videogames roleplaying
http://www.zybez.net,skipstil onyxrunescapegame tablesweaponweaponmelee wiki guides death includes contribute wikirunescaperunescape updatesequipment weaponsweaponmagic fandom items anyone weapons quests needle partalchemical database runescape skills monsters us wikihuntercraftingthe
http://www.mmogames.com,stackpath
http://www.everquest2.com,gaming adventure thousands generation players world community huge massively ii everquest next home online multiplayer come together
http://www.uo.com,online ultima
http://www.furcadia.com,record game userempowering furcadiafurcdigofriendfriendlyonlinesocialgameimagineimaginationdreamcreateexplorecommunitycreationdragonfurryroleplay let world friendly social soar imagination holding online furcadia
http://www.zeldauniverse.net,best largest world link navi majora walkthroughs triforce mask heroes princess fans fan game time waker worlds swords community place four past zelda every midna force news u ganondorf wind adventure sword universe majoras ganon wii adventures twilight legend ocarina uptodate tri skyward
http://www.d2tomb.com,knowledge page tomb ii home diablo
http://www.defiance.com,stackpath
http://www.rpgamer.com,reviews video one features ps performance xbox care rpgs rpgamer roleplaying might games news running switch editorials anything years pcreviews editorial content providing vita twenty take focused affect
http://www.warcraftrealms.com,realm population accurate data world site census warcraft wod realms wow
http://www.teso.mmorpg-life.com,scrolls life database elder eso maps things place screenshot fansite home brings online teso guides
http://www.eyesonff.com,vi xi classic latest viii x eyes reborn hearts ix iii eoff ii weve rpg games v xiii nostalgia releases news chirono trigger final xenogears love retro squall chross xii vii realm got iv cloud fantasy articles kingdom
http://www.aiondatabase.net,knowledge base database mmo aion
http://www.cavesofnarshe.com,caves narshe
http://www.nexustk.com,role world trial mpog event game awesome community mmorpg mud roleplaying orientated beta rpg winds games internet chat entertainment included nexus online quest multiplayer massive free playing leader anime kingdom
http://www.pso-world.com,news psoworldcom latest updates home
http://www.lurkerlounge.com,acceptable
http://www.silkroadforums.com,characters free page forum silroad silkroad discuss find forums guild play skills guilds online people come index
http://www.pokedream.com,video forums walkthroughs ash pokedream guides fan nintendo game site discussion featuring pokemon pikachu strategy games rpg news pokedex pocket content go pokemonrelated pokmon monsters walkthrough
http://www.stoacademy.com,sto star academy maps onlinestostar help information online trek helpsto
http://www.skyrimforums.org,rpg news forums skyrim teso
http://www.lotrointerface.com,rpg lotro game addons skins lotrointerface community mmo customization interface lord lotr online rings xml
http://www.abyssalchronicles.com,ver tales abyssal chronicles fansite homenews series beta
http://www.insanityflyff.com,insanity onlineflyff wikiflyff elementsdragon onlinelineage serveer elementsflyff server fly fun downloadflyff game onlinesilkroad mmorpgmmorpg mmorpg private play flyffflyff serveronline flyff nest online free gamesflyffflyff fantasy serveriris
http://www.gw2.mmorpg-life.com,material locations wars help fansite guide crafting guides map life maps mmorpg guild jumping classes news mmo puzzles database dungeon gw walkthrough
http://www.ageofwushu.com,age best art character consequences gamequesting game grinding master chinawowworld revolutionary games every gamealpha wulinaowage ancient mmommoshandamowhogministry years true wushu themed classlevelclassrandom delve relive fulfill testbeta gameshardcore warheroes gamesaerial first aow playfree dynastychinese chosenchinese mmo wulinchinese testsnail hardcore gameplay action world gameno gaiathe mmorpg story snail combataerialguildnpcrtshardcore usa martial aaa anticipated destiny graphics gamessnail gamemost wushuage warcraftblizzard levelno wushuwulinage journey chinese mmommorpgrpgaaafpfree wuxia artsperfect usagpotatokung tradition play fumartial innovative gamewuxiasuzhoubest gamenon dynastyancient face historychinese arts mmorpghardcore free colossal cutting unique npcaerial edge
http://www.fallensword.com,adventure free playing sword game explore role thousands players number vast fantasy realms across online fallen
http://www.eq2.eqtraders.com,corner traders eq
http://www.aq-3d.wikidot.com,adventurequest aqd wiki
http://www.terra-arcanum.com,games currently world upgrade terraarcanum troika
http://www.mapletip.com,characters destination character korea global jms msea help jobs looking guides fun maplestory wizet forum story mapletip item gms come kms cash party chat oms maplesea advance mapletipcom quest maple blog nx sea mapleglobal join tips market information tip nexon
http://www.auctioneeraddon.com,auctioneer addon
http://www.runescape.salmoneus.net,service well skill world help detailed looking guides maybe train knowledge community runecrafting sals passion selection players love quest thats g realm hardcore runescape wide check searching
http://www.urbandead.com,webbased free game survivors fight apocalypse control browser zombie urban massively mmorpg zombies ruined dead multiplayer gridbased city
http://www.simcountry.com,run peaceful regions gamevirtual five large empires membership countries continents strategic trade simulation war economic part game assets worlds try president mmorpg power login option play strategy build dominate welcome worldssimulation running online virtual many massive free playing presidents join economies simcountry please compete
http://www.imperial-library.info,library imperial
http://www.heromart.com,video music tshirts shipped teens adults undergro produced indie games shop packed official entertainment entertainments kids artix books online heromart products
http://www.diablo3ladder.com,world paragonsdiablo buildsdiablo seasonsbest leaderboard progress calculatordiablo clans legendary item rift season progressdiablo seasons statsdps ladder diablo buildsparagon greater diablodiablo calculator rankings statsdiablo rolls clansdiablo
http://www.forum.gmstemple.com,page default works apache debian
http://www.wowthinktank.blogspot.com,thinktank
http://www.ironsongtribe.com,ironsong tribe
http://www.animal-crossing.com,games nintendo animal official crossing home videos
http://www.pokemongodb.net,database go website news tips pokmon pokemon information charts guides
http://www.t4c.com,coming th desc realmud home
http://www.ds.heavengames.com,heavengames
http://www.nethack.org,nethack page home
http://www.elderscrollsonline.info,game scrolls tutorials database website find community addons elder eso mmo tes online videos everything quests guides
http://www.wow-heroes.com,ratings character info world pve warcraft wow heroes
http://www.bootstrike.com,bittorrent speed service pagan video torment laughter music windows kicked gate create design viii abyss vhs stygian faq home planescape hell bootstrikecom jokes ultima walkthroughs kerpal guides ngage vista mp worlds dog trainers serpent tutorial ii explorer singapore web black labyrinth beng downloads screenshots humor torrent cards greeting isle faqs tech patch hacks internet games humour support xp conversion kids school dualbooting greetings engineering ah computer vii tutorials underworld cheats genetic
http://www.thegoldqueen.com,queen live draenor garrison skill world profession tsm pets cap new guide crafting trade auction guides fast fan addons easy master legion gold movie warcraft strategy wow course snatch strategies professions plus house spots making warlords coaching farming list fishing farm
http://www.l2portal.com,map raid boss database portal news dropspoil drops drop latest calculator quest lineage
http://www.sorcerers.net,underdark age best torment tricks guide walkthroughs baldurs throne ruins game iii forum demon pool dao realms resource mysteries dragonlance games realtime strategies news toee rts greenwood tolkien heart storm stone planescape guides undrentide temple sorcerers ii drow stormreach soz rpg faqs hacks nights westgate books bhaal drizzt elemental faerun evil wizardry eberron da dragon tips information reviews zehir drannor bg gate elminster forgotten place r nwn screenshots icewind mods ed dragonshard hotu crpg origins sou dale online neverwinter cheats movies walkthrough review dd hordes faq mask hints consolidated maps motb dungeons downloads strategy shadows hack salvatore winter computer myth iwd dragons betrayer magic fantasy radiance mow
http://www.ffxivinfo.com,trailers info world ff forums ffxi lots date reborn release city guides states system guildleves stormblood combat eorzea featuring screenshots full item beta disciplines news final ffxiv online loot races aetheryte realm heavensward database wallpapers lists fantasy xiv information armoury hydaelyn abilities source
http://www.planetvampire.com,planetvampirecom home
http://www.thefinalfantasy.com,http page powered server test centos apache
http://www.thevaulttecinc.com,reviews ios latest new updates fo youtube future preservation fallout societal rpg vegas mods prepare program news videos vaulttec blog android memes hot get review
http://www.mmosite.com,lovers best soon game mmositecom protal mmo return
http://www.dynasty-warriors.net,required attention cloudflare
http://www.uffsite.net,vi coverage crisis xi cerberus ff forums dirge viii square fansite chronicles walkthroughs x advent versus fans ix chrono includes iii crystallis site discussion ii crystal defenders cross children series v xiii news trigger final offers nova media uff interviews vii xii extensive fabula iv enix fantasy uffsite information interactivity
http://www.tamrieljournal.com,scrolls community journal elder eso news fansite articles tamriel online guides
http://www.pokefind.co,free without mods introduces ip playpokefindco pokfind pokmon play needed server minecraft
http://www.planetcalypso.com,largest world economy first mmorpg avatar experience planet calypso possibilities real cash graphics scifi mmo offers virtual universe entropia endless unique themed money stunning
http://www.southperry.net,ranksgmskmsjmsemsmaplestory buildsevanfielknights databasemaplestory fansitehorntailaranmaplestorymaplestorypirateswz data southperrynet cygnusmaplestory lungskill fansite bangchaosheroeslegendsresistancedemon guidemaplestory maplestory calculatormu maplestorymaplestory bladedamage classesmaplestory buildrebalancingkmsgmsemsresistanceadventurerslegendsbig extractionsmaplestory bangdual slayermercedesmechanic rebalancingmaplestory extraction informationmaplestory information fileseosbig skillsmaplestory
http://www.suikosource.com,suikosource suikoden source
http://www.fiestafan.com,forumsfiesta forums boardsfiesta forumfiesta fansite active guides community fiestafan guidesfiesta marketfiesta ultimate fiesta communityfiesta online tradefiesta videos many leading market information pictures onlinefiesta
http://www.warofdragons.com,dragons game playing role mmorpg fantasy legend legacy
http://www.rephial.org,angband rephialorg home
http://www.eq2interface.com,iieqeqeqiisoeinterfacexmltgamodsskins everquesteverquest site ii everquest interface eqinterface
http://www.ladymoiraine.com,acceptable
http://www.roguebasin.roguelikedevelopment.org,roguebasin
http://www.maplewiki.net,maplewiki
http://www.metin2dev.org,metindev forums
http://www.animalcrossingcommunity.com,characters friend friends board discuss world new codes city fans patterns animal forum community site message wild trading games horizons ages folk items textures wifi crossing tips make leaf
http://www.rpgwo.com,rpg free game playing role mickey website world kudlo online multiplayer download
http://www.tibiame.com,rpg game mobile official homepage first tibia xhtmlmp handy mmorpg massively home roleplaying tibiame online multiplayer phones
http://www.winterwolves.com,new buy simulation mac life sim demo try trials otome full strategy rpg games platforms purchase dating versions manga computer download sport free order tycoon anime version downloadable pc
http://www.finalfantasyunion.com,dissidia vii anywhere wont find whether place final one fantasy else detailed information resource union everything ultimate
http://www.auno.org,aunoorg online anarchy resources
http://www.adom.de,adom variety world roguelike short depth immersion emphasizes game unityd story full successor ultimate platforms official homepage professions made biskup thomas items different created ancient quests many mystery domains wide skills fantastic
http://www.lotd.org,board guild message dead lords
http://www.junglebiscuit.com,gaming subjects junglebiscuit contains tips advise articles formula various guides
http://www.covenantofthephoenix.com,forums phoenix covenant home
http://www.twguild.org,twilight guild wow alexstrasza
http://www.shiningforcecentral.com,central force shining
http://www.anarchy-online.com,online anarchy funcom
http://www.kh-vids.net,forbidden
http://www.roguetemple.com,acceptable
http://www.worldforge.org,worldforge home
http://www.upnetwork.net,upnetwork board forum piecevbulletinjelsoftforumbbsdiscussionbulletin discussion network anime pokmon pokemonpokmonanimeone ultimate
http://www.d3jsp.org,logd league fg forum community maps green djsp trading lol diablo gaming goldfgjsphacksdjspdjsp legends igg dragon sell promisance legend starcraft
http://www.khguides.com,khguidescom enter keywords
http://www.eq2llinks.com,item everquest links eqlinks
http://www.lootdb.com,eq lootdbcom zones stats nameds guide communitycontributed mmorpg ii item mobs lootdb mmo everquest items loot database information db zone links
http://www.dynmap.ruslotro.com,gandalf mines archet eaves dwarf beornings waterworks wall lebennin belfalas game hobbit dunland black item beta north lothlorien downs old lossarnach wastes foundations kingstead northern eastern lord lotr ered westfold udun laketown playing southern orodruin paths vales trollshaws elf entwash mountains angmar agarnaith burglar delving tolkien vale blackroots osgiliath breeland doomfold galadhon gondor taur morgul stone luin shire zelemmelek breetown isengard npc eregion rohan march dalelands minas ithilien norcrofts barrowdowns south durins rpg mobs guardian wold west mmo broadacres warden items king walls talath multiplayer iron entwood east lotro felegoth flooded western mirkwood shadow glimmerdeep duskenvale grand annuminas steel information hunter dagorlad stair amroth ringlo sutcrofts slaghills role silvertine anorien shelob gate hultvis grimbeorns urui torech pelargir dolerernil way map flaming man deeps champion mmorpg evendim captain lodes aldburg deep havens central amarth crpg great keeper far anduin ungol dead online dale nomanlands caras marshes eastfold massively lamedon stormwall dynmap dol siege loremaster riders wildermore enedwaith naur thorins imlad nudmelek besieged moria wolfdenes npcs misty mithrin dor gorgoroth maps forest combat sundering entwade rune roleplaying redhorn zirakzigil forochel erebor edoras lhingris lodge gap minstrel quest computer quests rings mounted stonedeans keep rivendell mordor sammath ettenmoors dynamic rhosgobel beacon lonelands helms upper druadan hills sauron fangorn
http://www.acpedia.org,wiki community ac
http://www.blessingofkings.blogspot.com,kings blessing
http://www.chronocompendium.com,updates news
http://www.mbrepository.com,repository mb index
http://www.eternal-lands.com,lands website official eternal wwweternallandscom
http://www.photics.com,online photicscom since
http://www.guildseofon.com,seofon
http://www.mwmythicmods.com,mods mythic morrowind
http://www.skyrim-beautification-project.com,mods extensive modding beautification project guide skyrim enb
http://www.wildstar.mmorpg-life.com,info latest one guide talent guides path life place scientist spellslinger much explorer mmorpg wildstar news items warrior esper quests needs need database ever calculator stalker db mission brings information
http://www.virilneus.com,iv site virilneus gemstone
http://www.avlis.org,world portal avlis
http://www.maxdps.com,world news gear warcraft rankings maxdpscom
http://www.lotro-abc.com,downloadable music lotroabccom directory
http://www.darkswords.eu,rpg games free game playing role darkswords swords mmorpg dark web fantasy play online
http://www.virindi.net,virindinet
http://www.agonyguild.net,world agony guild warcraft ysera
http://www.dungeonblitz.com,freetoplay blitz mmo dungeon fantasy browser
http://www.taultunleashed.com,tault glitches wars world tools exploits guides bots taultunleashed star also mmorpg guild republic warcraft games hacks leveling rift old mmo bugs aion online lineage free swtor cheats macros
http://www.aionstrategies.com,casino aion online betting gambling
http://www.jerrec.com,lock lockpicking roguish lots home icemule rogue looking formulas guides way gemstone spell place much guild training direction voln jerrec course welcome types gs elanthia like jerrecs several geared lord toward critter lore houses creature statistical lair iv matters information links
http://www.istaria.com,building best character spells trades crafting game arcane avatar lairs occ horizons adventure playing craft structure upon values housing alt buy structures economy melee playable trading rich classes tradeskills mmo rp exchange class multiplayer icc lore lair vast sell istaria noninstanced powers role multiclass world adventuring server event trade schools community historical mmorpg events deep immerse construction persistent school online advancement massively history fp barter environment versus plot combat play player toon crafts plots built open dragons multiclassing free pve fantasy magic skills
http://www.nuvie.sourceforge.net,recreation empire vi martian running systems remake project dreams nuvie engine operating modern ultima savage open source
http://www.kh2.co.uk,hearts got ultimania birth sleep kh news dream drop recoded covered kingdom distance videos weve looking images
http://www.z64central.com,acceptable
http://www.wowmacros.info,druid world classic guide mage general rogue death priest warlock legion shaman monk warcraft demon azeroth wow games battle knight classes warrior beginner explained macro macros paladin hunter
http://www.guildwars2guru.com,world wars news mmo guild raids warcraft wow
http://www.worldofmatticus.com,matticus blog world raiders warcraft healers
http://www.pch.com,soon come back pchcom
http://www.betfair.com,teknolojileri bilgi kurumu iletisim
http://www.covers.com,teknolojileri bilgi kurumu iletisim
http://www.bet-at-home.com,teknolojileri bilgi kurumu iletisim
http://www.soccervista.com,predictions picks results soccer soccervista betting
http://www.vegasinsider.com,odds vegas news sports betting gambling
http://www.sportingbet.com,teknolojileri bilgi kurumu iletisim
