Domain,Content
http://www.twitch.tv,streaming things watch love millions world gamers platform leading around fans live chat twitch
http://www.roblox.com,virtual gaming together free global cloud brings platform worlds physics play online building people engine games mmo roblox
http://www.wowhead.com,battle warcraft wow site professions world transmog classes azerite featuring raids guides information news warcraftbattle azeroth largest
http://www.chess.com,club top also players members challenge online join hundreds chesscom watch community million solve compete play puzzles learn free analyze world chess lessons video friends prizes around games computer
http://www.ign.com,error ifwu unavailable ign
http://www.leagueoflegends.com,league legends
http://www.epicgames.com,digital site pc players store storefront creators curated epic mac mind games official designed
http://www.gamespot.com,comprehensive google stadia news xbox ps reviews switch one best game coverage trailers gamespot video including guides entertainment pc nintendo walkthroughs delivers games
http://www.playstation.com,koop playstation alle nieuwste playstationwebsite ps en ondersteuning vind nieuws videos systemen wedstrijden games vitainformatie officiële de
http://www.battle.net,entertainment blizzard
http://www.ea.com,arts console ea home site pc world inspire leading mobile page play games official electronic exist publisher
http://www.blizzard.com,entertainment blizzard
http://www.nvidia.com,forbidden
http://www.nexusmods.com,nexus community mods
http://www.xbox.com,wars generation deluxe events star preorder store forces backward elite products tb wireless live xbox soon specials wire anywhere site color stereo community redeem old k one microsoft accessories headset consoles play shop controller collection fans official enlister sales special gaming new limited design code nfl battlefront sale start system add network personalize edition windows reliable entertainment experience explore pc gears bundle advanced early lab features coming support war compatibility games battlefield armed
http://www.pcgamer.com,source gaming pc updates exclusive reviews gamer favorite franchises news demos
http://www.minecraft.net,gaming new site adventures buy merchandise accessories minecraft check download latest official news explore game
http://www.rockstargames.com,home psp videogames la redemption auto red dead xbox rdr theft play official payne gaming new lan gta video entertainment portable noire pc rockstar station grand max games computer
http://www.gamesradar.com,tv love closer gamesradar takes games movies
http://www.nintendo.com,site nintendo consoles video games official game
http://www.easports.com,basketball ea boxing hockey soccer football fighting video golf games sports
http://www.unity3d.com,visualizations realtime platform vr unity ar visulaization visualization development
http://www.itch.io,indie way covered online itchio something developer play latest game new simple download distribute looking whether find someone games upload youre
http://www.callofduty.com,call duty
http://www.wizards.com,wizards corporate website homepage coast
http://www.sporcle.com,error satisfied request could
http://www.kongregate.com,playing shooters free web ccg role action defense thousands tower kongregate play mobile online best discover games mmo
http://www.boardgamegeek.com,hobby gaming boardgamegeek since geekdo board boardgame geek games unplugged boardgames game
http://www.bulbagarden.net,community original bulbagarden pokémon
http://www.bungie.net,home store info place live xbox blam bungie myth developer official playstation straight oni stats games developers video th marathon column halo bungienet internet destiny
http://www.ubisoft.com,ubisoft official welcome website
http://www.icy-veins.com,wow warcraft detailed provides world veins storm classic heroes starcraft diablo icy iii guides news overwatch hearthstone
http://www.miniclip.com,puzzle free action play online fun flash adventure games multiplayer sports miniclipcom
http://www.pch.com,pchcom back come soon
http://www.eurogamer.net,since bad eurogamernet puns video games
http://www.betfair.com,odds golf online tampcs join racing best ways customers apply new free win betting horse bet betfair sportsbook cricket exchange get football br refund loses amp
http://www.activision.com,activision home
http://www.mmo-champion.com,wow warcraft strategies notes world previews upcoming patch raiding guides news content mmochampion
http://www.finalfantasyxiv.com,final xiv fantasy
http://www.mtggoldfish.com,trends speculators graphs online gathering archetype prices standard speculation strategy modern list decks mtg metagame charts legacy mtgo magic mtggoldfish stocks price
http://www.square-enix.com,
http://www.planetminecraft.com,forbidden
http://www.thesimsresource.com,sims downloads premium tens free login required daily thousands resource creations updated download tsr games quality
http://www.rockpapershotgun.com,indie journalism kieron rts interviews handsome thief modding online news blog ccp alec rock site warcraft gillen rpg community rockpapershotgun reviews bear gamer gamers best starcraft intelligent rossignol jim mod freeware game counterstrike gaming new deus horace rps subjectivity world fps compared mmo journalists endless opinion meer ex eve paper pc valve previews get john steam nothing walker games mog shotgun mods
http://www.travian.com,gameworlds directly legends players thousands game real famous recommended strategy play expert travian online browser multiplayer join international
http://www.pokemon.com,
http://www.giantbomb.com,bomb videos psp online news xbox largest ps reviews one wiki latest game wii video database forums ds giant features ngp
http://www.pogo.com,verification age
http://www.hattrick.org,deserves free original team manager world football hattrick play popular everybody online join game
http://www.covers.com,odds matchups live news information las scores lines sports picks need vegas nhl nfl gambling todays betting covers college mlb experts nba
http://www.runescape.com,gielinor mmorpg free rpg millions world fantasy game play best others exploring runescape online join already
http://www.rpg.stackexchange.com,exchange qa players roleplaying stack paperandpencil games gamemasters tabletop
http://www.paradoxplaza.com,like crusader hearts store buy europa iron kings universalis skylines cities interactive games official paradox stellaris
http://www.bet-at-home.com,top cash casino bonus poker odds life lot cool betting betathomecom register games plus online exciting sports game
http://www.minecraftforum.net,talk community great minecraft place forum forums official game
http://www.vg247.com,vgcom vg
http://www.worldoftanks.com,tanks free world play realistic tank online game
http://www.greenmangaming.com,green visit prices buy best keys game gaming daily awesome bundles deals man explore digital today exclusive get games
http://www.soccervista.com,soccer predictions results betting soccervista picks
http://www.games-workshop.com,games workshop
http://www.addictinggames.com,puzzle new free shooting every arcade thousands addicting funny play online addictinggames day games sports
http://www.sportingbet.com,sportingbetcom
http://www.gamedesign.jp,gamebrowser site free public gamedesign lot holds gamecasual games browser game
http://www.giantitp.com,giant games playground
http://www.vegasinsider.com,vegas gambling odds betting news sports
http://www.bethesda.net,unlimitedwolfensteinwolfenstein bloodwolfenstein studiosid iv online skyrimskyrimragebrinkwetthe orderthe onlinethe old howard withinthe softwarearkane scrolls game new gameworksbethesda fallout vegasdoomdishonoreddishonored softworkstodd gamestango oblivionoblivionbethesda scrollsthe elder evil falloutfallout v tamriel studioszenimax studiosmachinegamesmachine bethesdanet
http://www.arkadium.com,helping site user arkadium brandsafe revenue new traffic brands building increase interactive publishers retention keeps provides users engagement content
http://www.king.com,kingcom
http://www.wow-professions.com,profession leveling wowprofessionscom guides farming
http://www.mgmresorts.com,vacation resorts worldwide learn book today showcases best mgm next casinos dining entertainment lodging mgmresortscom shows international
http://www.n4g.com,hottest ng rumors latest news game
http://www.gameskinny.com,videos news xbox iphone ps reviews gamers one tricks android game passionate vita wii bringing wiiu video guides ds pc walkthroughs culture previews cheats games
http://www.game-debate.com,see performance compare recommended hardware minimum news test debate official game optimization system tools requirement requirements pc run well games computer
http://www.torn.com,torn moment
http://www.eveonline.com,space explore together free eve sandbox vast spaceships game set scifi play fly online fight mmo recordbreaking
http://www.wowprogress.com,wow top progress progression pve first rankings guilds armory wowprogress recruitment history statistic loot warcraft boss guild characters best strategy server mythic instance achievement rating player detailed world raid character kill realm wowprogresscom
http://www.cheathappens.com,console pc happens walkthroughs reviews wallpapers cheat cheats codes trainers game
http://www.roosterteeth.com,teams ops rooster se rwby jnr ace episode snowy season ropes tundra teeth show operatives
http://www.playok.com,playok online free games
http://www.shacknews.com,shacknews original celebrity reviews videos strategy interviews video content game
http://www.nintendolife.com,virtual also retro videos covered interviews indepth news along reviews switch cover consoles latest console life wii eshop ds nintendo features u
http://www.wowinterface.com,wow mists lua xml pandaria orgrimmar warcraft community addon worlds interfaces siege world warlords draenor addons skins interface mods
http://www.elderscrollsonline.com,home website elder welcome scrolls online official
http://www.elitepvpers.com,bots hacks less community get guides play anything cheats insider mmo elitepvpers
http://www.gamejolt.com,indie love jolt games game
http://www.oddschecker.com,forbidden
http://www.williamhill.com,casino odds online visit william worlds us bingo sports vegas poker gambling bookmaker betting bet biggest hill get games
http://www.gameinformer.com,informer source podcasts reviews previews features latest video news game
http://www.smogon.com,cap smog heartgold battle premier site community pokédex competitive strategy soulsilver university white project world tower channels popular smogon analyses forums pokemon strategydex pocket battling discord black pokémon platinum diamond cup articles featuring simulator shoddybattle monsters createapokemon
http://www.x-plane.org,xplane flightsim reg community
http://www.tibia.com,access denied used restrict cloudflare wwwtibiacom
http://www.dofus.com,les pour jeu massivement comics plusieurs online milliers damakna community multijoueur devenir de retrouver stratégique cheat dofus game toy maître free où system dans est video rôle multiplayer monde mmorpg pc rental addicting le joueurs un précieux mmo
http://www.hasbro.com,
http://www.flyordie.com,checkers pool curling board adventure online live racing play opponents free waiting chess multiplayer flyordiecom shooting lots snooker games
http://www.mmorpg.com,also news space site discussion community reviews gamers best search list mmorpgmmofreegamesreviewsforums coverage gaming free forums mmorpg exclusive provide mmorpgcom games mmo
http://www.gamasutra.com,virtual cmp conference art group gamasutra videogame making programming online directory xbox news business industry programmer reality ps arcade developer shaders blogs models jobs audio research textures magazine studio game modeling playstation new free daily design animation artificial producer developers independent video technology entertainment digital assets pc exchange nintendo delivered features dreamcast media software max intelligence games computer development
http://www.destructoid.com,u go news xbox iphone dtoid community ps reviews switch one cheat wiki latest codes game gaming vita wii trailers guides pokemon ds x destructoid pc nintendo walkthroughs previews games
http://www.gamerevolution.com,gaming pc ps reviews switch one gamerevolution guides news xbox
http://www.sportsinteraction.com,canada sportsinteraction online interaction bonus site trusted customers sports sia ineraction new canadian renowned betting joining sportsbook canadas get mobile
http://www.konami.com,always time machinesslot businesssports group groupholdingsdigital people machinescasino clubgaming creating business machinespachislotpachinko konamikonami valuable globethrough gaming manegement system systempachislot aiming highlyexpected companiesare corporation providing holdings around konami pachinko entertainmentgamesgamesports businesscasino wekonami
http://www.zone.msn.com,free games online msn
http://www.flalottery.com,florida lottery
http://www.funtrivia.com,
http://www.nexon.net,nexon home
http://www.playerauctions.com,wow osrs sell buy currency gold poe playerauctions
http://www.majorleaguegaming.com,miss events esports live favorite dont watch worlds best mlg coverage call duty overwatch hearthstone biggest halo featuring games
http://www.worldofsolitaire.com,solitaire spider free graphics undos leaderboards world freecell beautiful unlimited play klondike totally stats including games
http://www.calottery.com,california see draws access home new website state winning ticket lottery jackpots welcome next full games numbers
http://www.officefootballpool.com,basketball pool also bracket fantasy ranks pick squares golf pro pickem bets pools best share confidence picks nascar superbowl bowl survivor soccer nfl march key tournament including college ncaa hosting run office football madness baseball
http://www.websudoku.com,billions free sudoku play online web puzzles
http://www.starcraft2.com,galaxy across races site unique starcraft strategy wage official game ii powerful entertainment pc realtime three mac war blizzard
http://www.gtaforums.com,forums gtaforums
http://www.swtor.com,wars playing evolution star role bioware tor online information lucasarts site gameplay rpg old story bring official game knights massively swtor kotor next multiplayer mmorpg republic games mmo
http://www.totalwar.com,home total war
http://www.khinsider.com,khd updates web hearts drop community kingdom distance resource dream insider news largest
http://www.megagames.com,indie comprehensive editorials videos resource fixes freegames covering news xbox iphone mmog megagames ps reviews one ios patches codes gamcopyworld android freeware demos playstation gaming faqs free wii cracks games hardcore forums trainers founded pc nintendo emulators mobile cheats u mods
http://www.usa.philips.com,learn meaningful lighting lives innovation lifestyle philips improve states consumer healthcare help united people areas
http://www.armaholic.com,rangearmed forces arrowhead freearma operationsarma private covering assaultarmabohemia arrowheadarma reinforcementsarma arma series company forcesarma companyarma british gameshooter interactivesimulationpc assault operation armaholic combined military firing armed
http://www.gamefaqs.com,gamefaqs blocked
http://www.trophymanager.com,online game management football
http://www.jigsawplanet.com,created planetcreatecreatorphoto free community millions compete users play jigsawpuzzlepuzzlesonlinegamegamesjigsaw share jigsaw large online create puzzles
http://www.gamesindustry.biz,digital home industrygamers gamesindustrybiz sell retail gamesindustry resource interviews people foundry finance games news make
http://www.bet365affiliates.com,casino every pbenefit poker refer customer betting program profit affiliates share betnbspaffiliatesp bet bingo affiliate sports
http://www.aq.com,mmorpg new free adventures rpg quest fantasy aqw worlds evil fully artix animated adventure updated weekly dage game
http://www.us.playstation.com,console playstation site demo website reviews know videos accessories images detail games official explore game
http://www.mobygames.com,spanning every covers screenshots reviews oldest game platform mobygames trivia credits box games video database accurate largest
http://www.wow-petopia.com,
http://www.strategywiki.org,free guide walkthrough strategywiki wiki strategy
http://www.imperiaonline.org,medieval players time ultimate online join rule imperia come king strategy game free millions command multiplayer conquer war realm empire
http://www.partypoker.com,partypokercom
http://www.ncsoft.com,opportunities site career information links provides ncsoft welcome west official news company game
http://www.fileplanet.com,place betas directory downloads reviews patches beta demos free apps download discovery pc maps fileplanet software safest games mods
http://www.aqwwiki.wikidot.com,wiki aqworlds aqw
http://www.gameranx.com,gameranx lists video guides news game
http://www.supercheats.com,box xbox gameboy ps cheat collection super codes game playstation faqs code help advance games video ds x n pc nintendo walkthroughs massive dreamcast cheats systems walkthrus
http://www.nationstates.net,nationstates create country
http://www.frontier.co.uk,groundbreaking videogames frontier
http://www.gamespress.com,resource games press journalists
http://www.diablofans.com,builder community class diablofans diablo much forums unofficial
http://www.enjin.com,builder servers enjin perfect free clans community clan guild hosting websites website guilds minecraft customize forums create everything
http://www.chessbase.com,reports portraits launches world chess product interviews championships news tournaments chessbase
http://www.windrawwin.com,
http://www.runyourpool.com,basketball pool bracket runyourpoolcom pick service golf spread em premier pools us mens management confidence sports survivor nfl brackets march tournament college ncaa hosting run office football madness runyourpool point baseball
http://www.zylom.com,top genres free sudoku zylom choose cooking best play online popular games check
http://www.capcom.com,capcom
http://www.bodog.eu,casino claim online site bonus racing play trusted bodogis sports free poker gambling bodog betting welcome horse offering today games room
http://www.blizzardwatch.com,right wow warcraft watch old experts heroes diablo opinions insider news overwatch blizzard hearthstone
http://www.fantasyflightgames.com,games fantasy flight
http://www.eventhubs.com,hints smash tekken fighting titles much news bros capcom results plus eventhubs vs game marvel tips fgc popular tournament video street fighter games
http://www.gameloft.com,worldwide top publishing field since developer one gameloft mobile established leader video games development innovators game
http://www.bridgebase.com,club acbl free bridgebase duplicate site rubber world vugraph money wbf games base tournaments online bridge largest
http://www.siliconera.com,see read interviews impressions news blog siliconera unseen wont else game welcome games video side net international handson anywhere
http://www.kotaku.com.au,australia guide reviews gamers kotaku video computer news game
http://www.civfanatics.com,civfanatics
http://www.pokernews.com,tutorials source poker reviews pokernews freerolls worlds rooms strategy welcome reporting bonuses room online information live
http://www.ingress.com,divided ingress mankind control xm strange even together factions matter world energy choose maybe side discovery explore exotic two mysterious band prime
http://www.scssoft.com,presenting company scs corporate since testimonials homepage webpage simulation software statistics staff customers games projects development overview
http://www.offgamers.com,cards top cd store online card buy trusted codes securely keys game key credit paypal offgamers digital pc gifts games mmo gift
http://www.online-sweepstakes.com,sweep year online members directory largest premier cash community clubs sweeps ols contest webs giveaways contests millions several win prize web enter sweeping prizes dollars sweepstakes onlinesweepstakescom drawings
http://www.soccermanager.com,free much soccer manager fantasy football choose best market management tactics sophisticated formations transfer online game
http://www.emulator-zone.com,source computers home classic emulators consoles emulation latest zone emulator video game
http://www.online-go.com,ogs
http://www.gosugamers.net,moment
http://www.asianbookie.com,asian capital world handicap asianbookiecom
http://www.olg.ca,g l
http://www.gamedev.net,gamegame graphicsgraphics makingindiebeginnertutorialstechnologyjobsnewsgame developmentaugmented shadersonline engineassetstextures marketingindie resource blogd musicunity developergame gamesvirtual bloggamedevcommunitygdnetdeveloper realitygame community developerindie models gamedevnet softwareindie artgame designgame gamesgamedev game developmentddanimationmodelingpixel engineunreal independent realitymobile businessgame developmentmake programminggame enginegodot enginewebgl artopenglvulkandirectxgame mathgame gameshtml development producergame
http://www.worldofwargraphs.com,wow builds gear players pve world rankings pvp race best gems statistics guilds talents stats wargraphs classes enchants
http://www.intertops.eu,und events casino anmelden trust much online wetten bets american las enjoy intertops absolutely merits sportwetten play gratis best us register customers chance sports free give vegas poker soccer gambling world society win betting fun wette reputation bet sportsbook kasino multiplayer experience net kostenlos excitement games
http://www.ace2three.com,first rummy class online offers cash million card play acethree game gaming world win experience portal users indian games app indias
http://www.hidden-street.net,hidden asia europe jms takes online ems flight sea south gms east guides database kms versions street global maplestory
http://www.onelook.com,onelook dictionary search
http://www.cheatcc.com,much central site unlockables cheat strategy best codes game new faqs daily code millions world add popular video guides walkthroughs cheats
http://www.stardock.com,innovator site pc desktop stardock software entertainment specializing official utility cuttingedge
http://www.wildtangent.com,family pc enthusiast rent wildgames buy play online wildtangent try download games casual game
http://www.allscrabblewords.com,like letters scrabble unscrambler unscramble cheat jumble word anagram words anagrammer based scrabblefinder decoder finder using friends text generator lexolous solver games twist
http://www.cardplayer.com,comprehensive odds videos deposit forum online news offers blog bonus reviews results blogs bonuses series source player free poker world calculator tournaments tour rules internets
http://www.mousebreaker.com,puzzle top free action friv platform football kids play simulation online adventure mousebreakercom sport racing golf games
http://www.ayumilove.net,game ayumilove guides tutorial
http://www.jigidi.com,hundreds new created free every world users around jigsaw day online puzzles
http://www.mtgsalvation.com,spoilers mtg website trades card magic database including forums salvation news gathering
http://www.chessbomb.com,chessbomb watch chess analysis online computer live
http://www.7sudoku.com,free daily sudokucom sudoku traditional print play download online puzzles
http://www.officepools.com,free pools nhl nfl since customizable fantasy football officepools fundraising pgafantasy golf create sports join hockey leaders
http://www.gameknot.com,gameknot premier free battleground correspondence compete chess play games tournaments online join friends
http://www.gamedesire.com,many pool cards board online slots join thrill arcade play relax bingo word real gaming free poker world feel waiting fun saloon social blackjack enter casual entertainment multiplayer friends gamedesire mahjong games mmo
http://www.shockwave.com,puzzle dress car new free every shockwave shockwavecom cooking play best online racing download day games offers
http://www.megamillions.com,jackpot americas prizes two millions million one match optional mega big games megaplier
http://www.freeonlinegames.com,solitaire pool classic zombie food fighting board bmx flash adventure girl golf online puzzle rpg website card arcade killing thousands racing strategy play sports free managing flying fun driving educational including multiplayer action shooting fogcom shockwave addicting football funny war games
http://www.joanasworld.com,wow home classic leveling vanillaclassic joanas speedruns guides speed
http://www.gamerankings.com,gamerankings news indexes reviews sources offline plus articles around online video internet founded game
http://www.pcsx2.net,emulation online news ps play pcsx freeware game geforce playstation gaming sony free radeon download video windows linux pc amd fp intel emulator mac games
http://www.forzamotorsport.net,motorsport forza
http://www.fnatic.com,first since esports born every charismatic goal thousands household watching lead fans new fnatic become millions lifestyle world tournaments globally progamers brand recognised sport
http://www.polycount.com,polycount newsfeed
http://www.forum.ragezone.com,also account hardware programming forum community offer discussions gold latest server game servers gaming free graphic design download create ragezone tutorials mmorpg sell software files find support games development mmo
