Domain,Content
http://www.d20srd.org,dsrdorg searchable e system v reference fully indexed hyperlinked accessible srd contains pathfinder hypertext entire document
http://www.funbrain.com,videos comics online learning hundreds kindergarten grade preschool ages free funbrain books leader educational interactive education prek kids games content check
http://www.avsim.com,community fsx flightsim aviation flight simulation sim simulator online avsim
http://www.freetetris.org,free tetris
http://www.twcenter.net,center home total war
http://www.jagex.com,home runescape living games jagex publisher
http://www.valvesoftware.com,corporation valve hardware steam us games join make
http://www.romhacking.net,home homebrew utilities resources classic fan translations modifications video romhackingnet learning game
http://www.indiedb.com,indie pixel time rockin videos gallery news downloads site community reviews one direct ramen noodles independent developers forums tutorials db pc addons indy features previews powered media games development mods
http://www.vatsim.net,flying network online vatsimnet international
http://www.arena.net,life art worlds bringing arenanet online
http://www.pinside.com,favourite information show globe collection connecting share fans pinball game connect worldwide pinside knowledge welcome spreading silverball pinheads pinsidecom get around machines
http://www.howrse.com,manage horses free breed breeding equestrian horse howrse online center game
http://www.chessgames.com,pgn community scacchi ajedrez oldest schach chess chessgamescom best internets database games
http://www.belloflostsouls.net,rpg warhammer k bell lost rumors souls miniatures dragons dungeons news tabletop boardgames
http://www.riddles.com,problem cap rate submit quizzes week online answers brain adults hard best share enigma riddlescom puzzles new riddles tell logic day riddle library bottle easy comment teasers kids lucky tons
http://www.bladeandsoul.com,blade arts mmorpg journey confront forces soul vengeance dark freetoplay heroic master begin seek martial
http://www.obsidianportal.com,manage better websites roleplaying group tabletop obsidian dragons allows campaign games create rpgs dungeons portal game
http://www.darklegacycomics.com,legacy webcomic warcraft hatred psychopathy based gnomes world engineering sadness dark raids comics clones self mild
http://www.wineverygame.com,quickly letters scrabble unscramble updated jumble official word dictionary anagram game words anagrammer builder helper help win finder scrable create friends make want solver weg find wordfinder games
http://www.iccup.com,играть как icccup top ladder star скачать старкрафт ping esports throne place full online statistic cyber warcraft low frozen онлайн craft ладдер gamers starcraft best гайды server iii game allstars counterstrike iccup gaming бесплатно начать world broodwar terran zerg варкрафт games expansions dota сервер герои дота electronic international brood original cup cybersport sport protoss начинающим war icc esport internet icup помощь stars
http://www.xboxachievements.com,access denied used restrict cloudflare wwwxboxachievementscom
http://www.wowace.com,access denied used wwwwowacecom restrict cloudflare
http://www.diablowiki.net,wiki diablo
http://www.dakkadakka.com,wargaming dakkadakka k homepage articles gallery forums warhammer
http://www.gpro.net,manage right love prix team developing planning online success formula racing good game f hiring free manager race building future drivers multiplayer strategies staff grand cars fmanager
http://www.wsop.com,poker world play series online
http://www.rpgsite.net,playing source site rpg role information reviews previews premiere review interview media interviews video preview news game
http://www.jigzone.com,boring pictures beautiful work send jigsaw online postcards control puzzle jigzonecom thousands quick puzzles game free fun day distraction friends level family cuts days difficulty
http://www.adda52.com,access denied used wwwaddacom restrict cloudflare
http://www.kingdomofloathing.com,loathing kingdom
http://www.worldcubeassociation.org,world association cube
http://www.cad-comic.com,ctrlaltdel webcomic comic since gamers triweekly video games
http://www.freelotto.com,awarded online largest cash site million play freelotto chance free daily instant win enter prizes sweepstakes lotto games drawings
http://www.nerfplz.com,guides league nerfplzlol legends
http://www.conquerclub.com,gamemultiplayerworld club free risk domination gamefree play clubriskplay freegameonline gameboard online conquer
http://www.soccerpunter.com,hh leagues tips soccer competition predictions livescore get previews breakthrough soccerpuntercom football match soccerpunter results statistics tipsters
http://www.gamezone.com,forbidden
http://www.esportsify.com,esportsify deploying websites automated platform esports web creating professional
http://www.dulfy.net,wars black star old walkthroughs guild gw republic swtor desert online bdo dulfy guides
http://www.ivao.aero,virtual ivao aviation organization international
http://www.sigames.com,simulations manager world developer leading football management series interactive games sports
http://www.puzzlepirates.com,mmp puzzle mmorpg pirate persistent mmog java piracy world rum yohoho puzzling linux games puzzles pirates game
http://www.galottery.com,georgia lottery
http://www.gtplanet.net,car world culture racing covering motorsport games gtplanet
http://www.mrgreen.com,casino deposit award spins online live green join slots offer play sports free give betting double winning sportsbook mr today
http://www.the-crossword-solver.com,synonyms free thesaurus need ever anagrams letters solver missing crossword could search clues answers anagram
http://www.bettingpartners.com,best home partners
http://www.setgame.com,set playmonster
http://www.chesstempo.com,tactics chess
http://www.managerzone.com,online managermanager leading play management managerzone hockey sports game gaming free soccer manager world ice fun multiplayer football sport games
http://www.pokecommunity.com,role board forum fan trading discussion community card discussions play include fiction series fans white movies game tv world trivia pokécommunity forums pokemon pocket black strategies pc version pokémon pokãmon monsters games
http://www.x-plane.com,forbidden
http://www.bioware.com,wars gate star since mass bioware titles nights online old characters worlds neverwinter jobs acclaimed quality edmonton baldurs age arts high gaming console austin knights roleplaying develops rich effect discover focused dragon electronic stories publisher critically ea created pc unforgettable republic anthem games dai vast
http://www.taleworlds.com,home entertainment taleworlds
http://www.mabinogiworld.com,found
http://www.flashgames247.com,free flash online flashgamescom games
http://www.jspuzzles.com,puzzle pieces free daily adults kids play jspuzzles jigsaw large online puzzles game
http://www.poolhost.com,many manage pool home fantasy bowls squares online pools nflcollege free ufc nfl manager brackets march college derby run office madness carry
http://www.chaptercheats.com,faqs tips hints provider secret cheat chapter cheats codes video tricks games game
http://www.lotro.com,website information diaries asked questions boards lord message developers frequently online official rings game
http://www.basilmarket.com,talk screens gameplay videos basilmarket forum maplestory classes
http://www.illinoislottery.com,like powerball mega online illinois site buy official millions tickets possible anythings winning day get lottery find lotto lucky games numbers
http://www.strongholdkingdoms.com,medieval army first castles online across globe strategy play build stronghold game free world expand recruit mighty castle empire kingdoms mmo
http://www.codemasters.com,ahead console pc years leading codemasters racing mobile uk games publisher
http://www.metalol.net,players builds counters data best play build tier list champions based lol stats metalol guides current lists champion find use
http://www.perfectworld.com,swordsman star hotk homepage dynasty livelock online pwi saga ether battle perfect trek corporate highquality legend play jd neverwinter jade official martial fw arts game free champions world ii loma heroes mmorpgs entertainment international publisher mmorpg immortals forsaken blacklight retribution three eso torchlight war boi kingdoms
http://www.weaktight.com,review convert weak online weaktight holdemmanager community one hands fold limit postgres check free beat publish poker pokertracker sessions pot tight hand texas line omaha number know converter holdem youre
http://www.txlottery.org,cash two powerball daily millions lottery five scratch tickets play pick nothing mega lotto games texas step
http://www.fifplay.com,fifplay
http://www.waylandgames.co.uk,europes top wayland board tabletop infinity largest warmachine discount retailer k xwing miniatures savings warhammer malifaux independent workshop magic well games wargames
http://www.valottery.com,bank cash home virginia love powerball millions million cashlife lottery scratchers pick mega find including games official game
http://www.daveandbusters.com,events drink group gang restaurant local watch busters arcade play planner sports contact bar dave fun whole today eat large
http://www.sk-gaming.com,gaming believing sk
http://www.sega.com,website videos sega latest video games official game
http://www.askmrrobot.com,wow gem way suggestions dont simulations warcraft press one optimizer enchant button automatically optimize robot gear backed world theorycraft guides ask easiest mr get simulator azerite
http://www.gamesville.com,carnegie email also webhosting lycoscom university encompasses search engine mellon spun established network social web entertainment portal websites networking inc lycos
http://www.flashflashrevolution.com,flash ffrflashflashflash gamemusic music revolutionmusic flashffrflash dance filesstepmania communitygame gamessim revolutionddrstepmaniagame flashflashrevolutioncom sims rhythm chatdance revolution communitygamer gamesflash communityvideo games
http://www.freeworldgroup.com,best games fwg universe
http://www.psu.com,playstation themes ps reviews vita videos wallpapers pro news universe psvr
http://www.palottery.state.pa.us,ball club powerball players scratchoffs pick mega vip information visit benefits cash pennsylvania millionaire website every pa results pennsylvanians play fast latest hunt official game draw older millions treasure winning day wild lottery match lotto raffle games cashlife multiplier keno numbers
http://www.metin2pserver.info,servers serverroothamachipservercommunitytoplistlist oldschool metin serverpserverservermetinprivateprivateserverprivate looking p best newschool private privat server list good
http://www.racingandsports.com.au,australia results racing horse information news sports
http://www.tamiya.com,inc welcome tamiyaplasticmodelscaleminiaturercrccarradiocontrolwddangunracerhobby tamiya
http://www.lotro-wiki.com,lotrowikicom
http://www.esl.eu,legends esl online rock community one crossfire real arms counterstrike cs extreme national masters ops smite x prizes premiership mkx battlefield meisterschaft wcs pro platform leading play starcraft nordic sports opponents duty heroes шампионат replay multiplayer entertainment hearthstone global demo clan eslgaming halo bf mistrzostw fifa esports csgo forum championship cash turtle css wargmingnet series gaming skill call league lol tournament storm electronic sc black intel open bo war wgl europe национален kombat uk tanks competitive pokerth championnat combat south server hardline offensive magicka tv nationals world east ava major mortal wot cod polski evolve
http://www.ageofconan.com,site faq updates community information game wallpapers containing conan sites funcom forums official news development age
http://www.shoryuken.com,community shoryuken fighting largest web game
http://www.pj64-emu.com,nintendo project emulator
http://www.paxsite.com,pax dev aus east powered south west unplugged
http://www.ggmania.com,news xbox ps gameguru reviews switch one worlds leading best game gaming source mania wii trailers video trainers pc walkthroughs previews vr cheats u
http://www.gametrailers.com,see first destination arkham gameplay youtube hottest gamer uncharted batman official worldfirst game gaming new city trailers expect video gametrailers pax gears exclusive tra ign powered war games battlefield
http://www.privateerpress.com,press publisher privateer game
http://www.psxextreme.com,playstation things ps extreme reviews since one oldest publications world psx making us covering news
http://www.1up.com,home podcasts screenshots reviews call previews gamers info trailers cheats latest video upcom guides information news game
http://www.bluesnews.com,post blues thats fit news carnage
http://www.lasvegassportsbetting.com,parlays las vegas odds betting bet online sports picks
http://www.chessmaniac.com,chessmaniac
http://www.onrpg.com,gamelist shooters first moba since journalism videos recommended review videogame greatest forum online onrpg news browser rpg community reviews play best keys beta giveaways game gaming source free henderson fps darren key trailers look mmorpgs mmorpg access pc lists early previews mobile games preview mmo
http://www.attheraces.com,home odds news form races partner racecards results racing comparison sports tips replays horse video digital get features sky
http://www.wizardofodds.com,like casino guide odds played mathematically online information hundreds others gambling roulette correct blackjack strategies craps casinos games wizard
http://www.popcap.com,many back sprinkled smileinducing whirlwind site devices popcap even best play official may console world shiny able ea awesomeness pc keeps studios mobile polished coming find games sheen moon
http://www.ddo.com,online dungeons dragons
http://www.g4tv.com,wire games syfy
http://www.zygorguides.com,like wow zygor guide elite legion online ingame warcraft gain gold scrolls achievements game world leveling horde sign alliance guides accomplish access elder games professions
http://www.larian.com,playing years love players role spend homepage passion making larian located belgium developer play proud thanks studio game genres platforms independent gent create days get studios games multiple
http://www.docsports.com,docs predictions odds pick spread ats best docsportscom picks sports free daily tips guaranteed betting expert parlays experts tonight
http://www.mcprohosting.com,factorio hosting game start worlds highest performing platform minecraft mcprohosting ark server largest
http://www.creativeuncut.com,library monsters artists home concept environments characters creative art artworks curated titles galleries video uncut official explore game
http://www.simviation.com,planes helicopters capital flighgear martin msfs jets simviation ons information lockheed tos xplane space downloads civil tens instruction vintage gliders fsx site thousands flight worlds microsoft navigation accessories file fs choppers combat series historic plus quality freeware high pages pd free world complete add flying sim help edition prepard jet forums fsxse tutorials orbiter x pc addons fighters flightsim aircraft simulators steam simulator files support fsw military addon
http://www.skyvegas.com,football racing sky betting horse bet online sports
http://www.mabinogi.nexon.net,found
http://www.lineage2.com,
http://www.dragcave.net,enter dragon cave
http://www.betus.com.pa,racebook casino odds payouts got online news favorite bets americas betuscom betus lines us fast bonuses sports game book wagering tips poker nfl gambling race betting horse bet sportsbook football weve internet amp
http://www.thegamecrafter.com,world crafter board print welcome leader demand games game
http://www.l2topzone.com,players classic five private l forum final join interlude promote community website server high servers traffic popular helios get want gracia lineage
http://www.rebellion.co.uk,website rebellion official
http://www.mmogah.com,dfo fifa ever items fortnite power mmogah gold shop rs osrs currency leveling gil swtor coins ffxiv runescape poe trustworthy eso credits
http://www.theborgata.com,casino borgata spa place online dine visit favorite dance one play us city atlantic poker nj hotel stay games
http://www.candystand.com,pchcom back come soon
http://www.flyawaysimulation.com,downloads news reviews flight simulation fly sim away
http://www.thehendonmob.com,forbidden
http://www.teamliquid.net,brood gaming news community emphasis esports starcraft focused professional tlnet war
http://www.gonintendo.com,emblem gonintendo smash devoted community switch zelda fans waiting video ds nintendo rawmeatcowboy brothers thriving fire mario games everything
http://www.wow-pro.com,warcraft brings world pro experience game
http://www.needforspeed.com,arts explore ea site pc need leading mobile consoles video games official electronic speed publisher
http://www.curse.com,fandom wars source things site come daily first tv star fallout marvel games including fans movies entertainment dc
http://www.team17.com,group team home plc
http://www.conceptispuzzles.com,conceptis variants variations weekly online ipad iphone puzzle smart worlds best play puzzles android new free nonstop logic fun paper get mobile pencil games
http://www.worldsportsbetting.co.za,tote livesportsbook place tennis golf online bets premier site results racing sportamerican sports bettingbet sas soccer rugby gambling world national bookmaker betting horse cricket international sportsbetting football lotto
http://www.pokerlistings.com,forbidden
http://www.brainden.com,paradoxes enjoy brain riddles adults optical teasers kids logic fun illusions games puzzles jokes
http://www.photonengine.com,available os html unreal service asynchronous cross synchronous platform ios others engine android saas game backend sdks windows multiplayer net made easy global cloud applications unity photon mac games development
http://www.educationquizzes.com,ages years recall gcse aged ks quizzes teacherwritten plus active using
http://www.calvinayre.com,calvinayrecom industry conferences premier casino site global poker gambling betting analysis covering opinions online news sports
http://www.braingle.com,brain riddles teasers braingle trivia games puzzles
http://www.masslottery.com,state massachusetts lottery
http://www.menteativa.com.br,mente ativa preservar mind active games jogos para
http://www.footballlocks.com,pool plays predictions odds rankings fantasy pick weekly week footballlockscom backwards handicapper online pro spread information ats las lines power prediction strategy handicappers sports picks game wagering tips vegas nfl spreads gambling straight projections betting expert handicapping using line made standings schedules provides previews football point games
http://www.dice.se,home dice
http://www.diabloii.net,home wikis diablo diabloiinet iv forums news
http://www.rubiks.com,iconic home website howtoguides official north america cubes puzzles rubiks
http://www.tsf.org.tr,türkiye federasyonu satranç
http://www.guildwars.com,guild wars
http://www.coloradolottery.com,home powerball proceeds pick mega cash site official variety millions life tickets colorado state lottery scratch lotto lucky games
http://www.contestgirl.com,contests site free today tools one sweepstakes worlds nononsense need start freebies winning online directories stuff giveaways largest
http://www.gpwa.org,gambling webmasters portal association
http://www.gameranger.com,gameranger online play friends
http://www.alawar.com,minigames free buy alawars want causal play best online titles download including games demos
http://www.pokerprolabs.com,home advanced players poker tools labs rankings buddy page software online list pro
http://www.reapermini.com,miniatures reaper
http://www.hotwheels.com,things dvds tracks gifts website today buy sets hot accessories shop cars discover latest official wheels gift
http://www.clubxiangqi.com,úp club xiangqi chinese tướng chess play cờ chơi
http://www.entropiauniverse.com,virtual account scifi economy news cash site universe unique official real basics learn world multi create experience tutorials mmorpg read entropia
http://www.triviaplaza.com,computers site classical quiz movies quizzes play trivia triviaplaza music science online pop literature geography
http://www.advancedcombattracker.com,tracker advanced log combat parser mmo
http://www.cat-bounce.com,cat cats website bouncing bounce
http://www.crosswordtracker.com,tracker puzzle stuck finishing get solver crossword search engine solving never ensures
http://www.iaapa.org,business industry amusement access expos conferences global spread attractions association best parks practices iaapa members successful
http://www.cardsagainsthumanity.com,humanity cards buy party horrible people read game
http://www.nfscars.net,downloads tracks world need nfscars cars tools news speed
http://www.suninternational.com,hotels group resortaccommodationcasinoconferencing sun destinations premier boasts eight resorts gaming meetings city entertainment international countries suninternationalsun find casinos holiday
http://www.myth-weavers.com,email npc board e darkness dragons forum online pbp rpg community play gaming pbem post mythweavers world roleplaying dd edition focuses message dungeons serenity powered character sheets vbulletin wod
http://www.arizonalottery.com,arizona many opportunities back communities state provides giving lottery win local games dozens
http://www.realitymod.com,bf army illusions online join warfare reality community modes arma realistic modern bohemia game gaming variety new vehicles canadian pla project realism complete prmm united israeli including interactive british multiplayer modification nations digital ea pc bi assault action today redefined states weapons growing pr mec mods military featuring war games battlefield armed
http://www.playrix.com,gardenscapes township team behind world one leading mobile developers fishdom playrix game
http://www.bandainamcoent.com,generation tekken connected america much dragonball news visit favorite join bandai site pacman dark latest naruto gaming learn world sign next web entertainment today get souls namco games
http://www.mohegansun.com,like casino great resort rooms spa sun golf live much performances enjoy pools ct us luxury mohegan getaway gaming next amenities connecticut plan excitement stay
http://www.zam.com,home come community resources million hottest wowhead gamers stormshield worlds passionate players online welcome reliable games join fanbyte
http://www.thechessworld.com,many learn skills tips improve chess help win lessons materials games thechessworld game
http://www.scummvm.org,scummvm home
http://www.minecraft-statistic.net,servers countries players version modes skins monitoring statistics minecraft search server list plugins
http://www.mamedev.org,mamedevorg project home mame
http://www.natfka.blogspot.com,k rumors faeit news warhammer
http://www.heromachine.com,sketch portrait scifi fantasy creator character superhero create heromachine
http://www.trainsim.com,trainsimcom home
http://www.wotstats.org,progress players progression efficiency tracker tanks wotlabs рейтинг 坦克世界 вот eu combat sea statistics ru rating game wotstatsorg instant world na stats wargaming mmorpg update wn wot калькулятор ффективности check
http://www.betshoot.com,access denied wwwbetshootcom used restrict cloudflare
http://www.doomworld.com,forums doomworld
http://www.buffalopartners.com,buffalo partners
http://www.nisamerica.com,america inc nis
http://www.textadventures.co.uk,text textadventurescouk play adventure share fiction interactive games create stories
http://www.dorkly.com,email adschmediacom videogames youtube sega channel comedy gaming inquiries advertising welcome video dork collegehumor nintendo dorkly funny mario games
http://www.paf.com,casino vuodesta mahtavan pelaa helposti peliiloa jo rahapelejä pelivalikoiman ja paf parissa pafcom vuotta casinolla yli netticasinoa hauskanpitoa netticasino viihdy ilmaiseksi rekisteröidy
http://www.magicspoiler.com,spoilers new cards mtg spoiler magic date visual news gathering
http://www.wakfu.com,addictive environmental comics emerging online wakfu political community cheat strategic bring real game toy new free warrior world system heroes craftsman video multiplayer mmorpg pc merchant rental addicting whether youre ruins politician hope depends mmo everything
http://www.zdoom.org,start zdoom
http://www.instantwincrazy.com,acceptable
http://www.wilottery.com,site wisconsin homepage lottery official
http://www.ffshrine.org,armor advent ultimate fantasy children xii irc square iv final chat music news downloads ix characters soundtracks shrine squaresoft summons vi mps vii trailers ff tactics advance forums squarenix fansite crystal x squareenix walkthroughs walkthrough magic weapons enix v chronicles xi viii media offering
http://www.mmohuts.com,forbidden
http://www.gamefreaks365.com,acceptable
