Domain,Content
http://www.mgmresorts.com,best casinos lodging mgmresortscom mgm resorts dining entertainment learn book next today international worldwide shows vacation showcases
http://www.oddschecker.com,teknolojileri bilgi kurumu iletisim
http://www.williamhill.com,teknolojileri bilgi kurumu iletisim
http://www.flalottery.com,lottery florida
http://www.sportsinteraction.com,teknolojileri bilgi kurumu iletisim
http://www.calottery.com,see games ticket winning state access website welcome lottery full draws new next home numbers jackpots california
http://www.officefootballpool.com,run office best college tournament confidence bracket soccer pro survivor bowl football ranks including nascar march baseball golf also share madness pickem key pool bets nfl ncaa squares pick pools picks superbowl hosting basketball fantasy
http://www.contests.covers.com,found
http://www.bet365affiliates.com,profit casino bingo affiliates every program share poker sports bet betnbspaffiliatesp refer pbenefit customer betting affiliate
http://www.partypoker.com,teknolojileri bilgi kurumu iletisim
http://www.paddypower.com,teknolojileri bilgi kurumu iletisim
http://www.bodog.eu,teknolojileri bilgi kurumu iletisim
http://www.asianbookie.com,asianbookiecom world handicap capital asian
http://www.windrawwin.com,
http://www.online-sweepstakes.com,year largest onlinesweepstakescom clubs drawings giveaways sweepstakes community enter prizes web cash contests contest millions several dollars online win sweeps members sweep premier sweeping ols webs directory prize
http://www.runyourpool.com,run office service point college tournament confidence bracket sports mens survivor football march baseball golf em madness pool nfl ncaa pick management pools spread runyourpoolcom runyourpool hosting basketball premier brackets us
http://www.pokernews.com,teknolojileri bilgi kurumu iletisim
http://www.olg.ca,l g
http://www.cardplayer.com,teknolojileri bilgi kurumu iletisim
http://www.megamillions.com,games megaplier match two optional mega prizes millions one big million americas jackpot
http://www.intertops.eu,teknolojileri bilgi kurumu iletisim
http://www.officepools.com,pgafantasy free nhl golf leaders since hockey officepools join customizable pools sports create fantasy football fundraising nfl
http://www.cardschat.com,teknolojileri bilgi kurumu iletisim
http://www.mrgreen.com,teknolojileri bilgi kurumu iletisim
http://www.freelotto.com,
http://www.adda52.com,teknolojileri bilgi kurumu iletisim
http://www.soccerpunter.com,teknolojileri bilgi kurumu iletisim
http://www.wsop.com,teknolojileri bilgi kurumu iletisim
http://www.galottery.com,georgia lottery
http://www.illinoislottery.com,day winning lottery illinois anythings powerball buy lucky site lotto find possible games tickets official mega like millions online numbers get
http://www.poolhost.com,run office college manager carry home march madness pool bowls nfl squares derby pools online manage many ufc free nflcollege fantasy brackets
http://www.bettingpartners.com,partners best home
http://www.txlottery.org,cash games tickets texas two mega step lottery five pick scratch millions powerball lotto play nothing daily
http://www.valottery.com,games cashlife cash game scratchers official mega virginia lottery bank pick love millions powerball home million find including
http://www.weaktight.com,pot number one hand texas youre community fold poker postgres weaktight hands line pokertracker review holdem convert holdemmanager tight online weak free converter beat omaha sessions publish check know limit
http://www.palottery.state.pa.us,day winning match website millionaire hunt lottery latest powerball fast game club multiplier raffle results lotto play vip wild games benefits cash every players mega pick official millions ball pa cashlife scratchoffs draw older information numbers visit keno pennsylvania treasure pennsylvanians
http://www.expekt.com,teknolojileri bilgi kurumu iletisim
http://www.racingandsports.com.au,australia racing news sports results horse information
http://www.docsports.com,odds best parlays sports experts predictions guaranteed daily ats tonight docs pick spread picks free docsportscom tips expert betting
http://www.attheraces.com,odds video sports sky form features home comparison racecards results horse digital racing news partner races replays tips get
http://www.lasvegassportsbetting.com,odds vegas parlays sports bet picks online betting las
http://www.thehendonmob.com,forbidden
http://www.calvinayre.com,calvinayrecom casino premier site poker news sports global conferences industry analysis online covering betting opinions gambling
http://www.worldsportsbetting.co.za,rugby national world sports soccer tennis football bookmaker sportamerican golf site place results horse lotto bets cricket racing bettingbet sas online livesportsbook gambling sportsbetting premier tote international betting
http://www.betus.com.pa,teknolojileri bilgi kurumu iletisim
http://www.pokerlistings.com,teknolojileri bilgi kurumu iletisim
http://www.theborgata.com,dine one city place poker play games atlantic hotel borgata online spa nj casino dance stay favorite visit us
http://www.wizardofodds.com,teknolojileri bilgi kurumu iletisim
http://www.masslottery.com,lottery state massachusetts
http://www.footballlocks.com,odds spreads point sports wagering plays standings pro football las footballlockscom game predictions straight schedules power weekly using line pool strategy nfl games vegas projections ats pick backwards made spread week picks provides online handicapper gambling handicapping lines previews prediction tips fantasy information rankings expert betting handicappers
http://www.coloradolottery.com,variety scratch lottery proceeds powerball home lucky life state site lotto cash games tickets official mega pick millions colorado
http://www.skyvegas.com,racing sports bet sky horse online football betting
http://www.paf.com,teknolojileri bilgi kurumu iletisim
http://www.suninternational.com,casinos suninternationalsun meetings countries boasts eight city resortaccommodationcasinoconferencing hotels find entertainment destinations gaming premier resorts sun group holiday international
http://www.igbaffiliate.com,affiliate operates magazine igb industry conferences igaming publishes business
http://www.contestgirl.com,contests free need giveaways sweepstakes stuff worlds largest directories start site winning freebies one tools online today nononsense
http://www.mohegansun.com,live luxury ct golf connecticut much next enjoy resort rooms great amenities like pools getaway performances plan gaming spa casino sun mohegan excitement stay us
http://www.gpwa.org,association portal webmasters gambling
http://www.michiganlottery.com,winning website lottery view powerball buy current instant lotto games official homepage mega michigan millions online jackpots twentyfour hour fantasy numbers
http://www.pokerprolabs.com,rankings page buddy players list poker software advanced home tools pro online labs
http://www.foxwoods.com,travelromantic variety meetingluxury features accommodations ct dining attractions connecticut deluxe pequotledyard getawayreservationsgolfbest vacationsbusiness ctfamily resort shopping entertainment fine casinosresortshotelsmashantucket lodgingaccommodationsaccomodationsspasuitesvacationgetawaysdiscountroomsarea casino foxwoods wide
http://www.buffalopartners.com,partners buffalo
http://www.betshoot.com,teknolojileri bilgi kurumu iletisim
http://www.wilottery.com,official homepage site lottery wisconsin
http://www.arizonalottery.com,games many communities state opportunities dozens lottery local arizona back provides giving win
http://www.instantwincrazy.com,acceptable
http://www.indiarace.com,portal racing first indiaracecom indias foremost horse
http://www.clubwpt.com,day live world including game k share poker prizes tournaments events play vip cash packages real every wpt official online clubwpt tour chance main monthly brought
http://www.sportsinsights.com,odds live sports ncaab industrys help smarter ncaaf site trends track bets today nfl move insights platform advanced mlb analytics lines forces nba make visit betting
http://www.mnlottery.com,homepage lottery minnesota home
http://www.pickuphockey.com,office nhl forums manager easy officepools community pickem pool pickuphockey ultimate hockey pickup pick news pools set online free customizable fantasy fully
http://www.sclv.com,vegas station casinos resorts hotels las
http://www.crownmelbourne.com.au,accommodation packages casino explore best restaurants melbourne welcome special offers book hotels melbournes online crown
http://www.holdemmanager.com,heads analyzing new manager help game page opponents hm table poker visual display users official holdem provides tool information identify
http://www.blackjackapprenticeship.com,teknolojileri bilgi kurumu iletisim
http://www.star.com.au,accommodation casino star dining entertainment group worldclass luxury awardwinning
http://www.pokeratlas.com,teknolojileri bilgi kurumu iletisim
http://www.10bet.com,teknolojileri bilgi kurumu iletisim
http://www.pocketfives.com,pocketfives home
http://www.uffiliates.com,real programs affiliates earn money affiliate
http://www.walottery.com,game match keno scratch mega lottery millions washington powerball lotto wa hit washingtons daily
http://www.motorcitycasino.com,casino like detroit experience hotel motorcity luxury
http://www.poolexpert.com,office baseball mobile league apps hockey realtime commissioner individuals pools network manager fantasy updates private social pool poolexpertcom
http://www.usamega.com,anaylsis statistics winning search lottery latest faq powerball millionslotteryresultswinning home results lotto usa play past jackpot daily games pages mega news powerful millions multistate drawing win extensive numbersstatisticsjackpotnews history powerballmega engine numbers
http://www.cityindex.co.uk,markets forex trade range leading join global spread city wide uk financial online cfd betting provider index trading
http://www.casinocity.com,directory casino city
