Domain,Content
http://www.bgsu.edu,green public state graduate top success academic lead bowling university ohio nationwide career quality programs undergraduate 
http://www.annualreviews.org,nonprofit knowledge synthesizing society progress reviews publisher dedicated science benefit integrating annual 
http://www.biologydictionary.net,concepts terms cell genetics examples definition explanations dictionary including provides common biology ecology biological molecular quiz 
http://www.nsf.gov,made national accomplished country educators advance engineers across mission research scientists foundation science funding proposals nsf progress nsfs education 
http://www.synopsys.com,helps world application design testing secure smart integration semiconductor electronic forefront synopsys security technology solutions silicon everything verification customers advanced software ip automation deliver eda chip tools quality innovate 
http://www.metservice.com,metservice tirorangi te ratonga 
http://www.umbc.edu,challenges umbc public research students supports find dynamic university excites program honors community maryland 
http://www.homeschoolmath.net,concepts online resources math includes guide emphasize homeschoolmathnet rules lists games comprehensive curriculum parents instead resource mechanical videos ebooks lessons homeschooling free homeschool understanding teachers reviews memorization worksheets site 
http://www.xilinx.com,intelligent xilinx adaptable 
http://www.lyngsat.com,sr viaccess transponder mpeg sid biss pid analog satellite lyngemark tv dss cryptoworks radio hevc channel lyngsat digicipher mediaguard fta conax irdeto pal isdb digital dvbsx uhd powervu hd dvbs free videoguard frequency mux ras chart avc fec abs ns dvb 
http://www.uneca.org,united africa nations commission economic 
http://www.eng-tips.com,structural disciplines computer chemical forums civil automotive engineers work forum aeronautic engtips professionals engineering aerospace community intelligent 
http://www.insee.fr,tudes national la insee produit conomiques sur de diffuse informations collecte statistique des francaises conomie et analyse socit l institut 
http://www.cas.org,scientific facilitate research cas products drive empower provides discoveries help empowering services learn innovation 
http://www.omniglot.com,online phrase kanji encyclopedia phrases guide syllabaries alphabets languagerelated syllabary links hieroglyphs omniglot accent rune written font glyph foreign abjads hanzi languages translation texts systems alphabet encoding letter writing abuguida multilingual hanja script symbol character syllabics useful cuneiform chinese language unicode diacritic much tips learning 
http://www.cadastre.gouv.fr,des leconomie lindustrie finances cadastre du de et ministre wwwcadastregouvfr un site 
http://www.stat.go.jp,
http://www.biology.arizona.edu,project biology 
http://www.convertworld.com,online volume calculators mass unique time currencies unit used weight interactive converting use conversion tools distance free 
http://www.aeaweb.org,american economic association 
http://www.scau.edu.cn,scau agricultural china university south 
http://www.graphpad.com,graphpad home 
http://www.easycalculation.com,online calculator math converter free 
http://www.analyzemath.com,coming soon 
http://www.astm.org,standards worldwide international astm 
http://www.micron.com,micron inc technology 
http://www.unwomen.org,global rights every champion empowerment human develop create woman girl exercise potential life girls achieve gender full environment trusted partners live equality entity women headquarters working decisionmakers advocates united standards walks nations phumzile mlambongcuka uphold leader effort un 
http://www.web2.0calc.com,expression online problems math renderer calculation history plots calculator equation numbers calc solve complex mathematics physics solver converter advanced notation web scientific free tool unit engineering 
http://www.nctm.org,council mathematics teachers index mathmathetics national pbrp 
http://www.federalreserve.gov,dc board home governors washington reserve federal system 
http://www.meteo.be,irm kmi 
http://www.carnegielearning.com,transformative high solutions curriculum combine math intelligent professional consumable school carnegie services software textbooks learning middle tutoring 
http://www.jbc.org,biological journal chemistry 
http://www.nrich.maths.org,mathematics resources students teachers nrich algebraarithmeticcambridgechildrencurriculumeducationenrichmentgeometrymathmathematicsmathsmathsnrichnumberpatternprimaryschoolsecondaryshapesymmetryteachersteachingtrigonometry parents enrich learning 
http://www.mises.org,institute mises 
http://www.oeis.org,integer online sequences sequencessloane oeis encyclopedia oeisinteger 
http://www.reprap.org,redirecting 
http://www.istat.it,istatit 
http://www.coolmath.com,online geometry prealgebra math art polyhedra trigonometric geometric games fractals precalculus calculus college fun parents activities algebra exercises clear mathematics graphing fractions arithmetics really puzzles trig lessons trigonometry children free apps high grades calculators coolmath teachers tessellations interactive school cool areas 
http://www.99bitcoins.com,supplies bitcoin wallets buy tutorials mine best reviews mining exchanges bitcoins date 
http://www.snow-forecast.com,world weather around conditions snow forecast weathersnow resort skiing reports informationsnow webcamssnow conditionssnowforecastcom webcams ski live resorts reportsski mapssnow thousands reviews forecastpiste detailed 
http://www.sgs.com,global certification inspection sure sgs company worlds verification testing need leading recognized benchmark integrity quality 
http://www.studyspanish.com,drills online audio studyspanishcom grammar notes vocabulary helpful tutorials sites spanish verbs cultural learn links free 
http://www.foreignaffairs.com,global indepth russia geopolitics affairs east relations north us korea leading magazine foreign europe policy analysis debate middle 
http://www.fas.org,world safer scientists informed federation american science 
http://www.spectrum.ieee.org,error found 
http://www.ucanr.edu,invalid denied access credentials due unauthorized 
http://www.earthsky.org,space world austin nature human based news daily team updates alerts star night images love photos blast welcome sky tonight photography science cosmos earthsky tx earth bringing tips community 
http://www.genome.gov,genomics official home research website human forefront genome institute national nhgri 
http://www.smhi.se,beslutsunderlag vdertjnster inom vder blir vderprognoser myndigheter hur idag erbjuder smhi dig sverige hydrologi klimat foretag och meteorologi oceanografi vdret 
http://www.spacex.com,space spacespacexaerospaceelon designs launches spacex muskmarsfalcon manufactures falcon heavydragon technology enabling ultimate advanced live people rockets founded revolutionize company spacecraft goal planets 
http://www.iadb.org,
http://www.ebi.ac.uk,bioinformatics european europe emblebi institute 
http://www.tiss.edu,welcome sciences social institute tata 
http://www.enfsolar.com,world products solar battery production list panel suppliers top components manufacturers photovoltaic equipment directory mounting source inverter companies including manufacturing cells customers enfsolar installers pv enf panels system connecting information 
http://www.lenntech.com,products designs drum treatment installs uv odour air builds ozone using wide range purification water ecosorb also lenntech cooling filtration towers 
http://www.waset.org,world meetings academy conferences events technology papers engineering science 
http://www.statisticssolutions.com,years research online statistics resources solutions consulting dissertation leader statistical analysis software advancing 
http://www.explorable.com,authorization required 
http://www.geonames.org,geonames 
http://www.inaturalist.org,naturalists inaturalist community 
http://www.eetimes.com,global eelive eelife design opinion courses news fundamentals analysis tech analog video business electronic components technology education electronics designline electrical learning times part systems silicon digital university product papers software signal eet connecting semiconductors embedded ee mixed search engineering community 
http://www.etranslator.ro,englez online audiomponline si engleza dictionary gratuite romanaengleza texte sms romana dictionar gratuit de roman umane automate fraze translator audio expresii curs englezaromana traduceri traducere 
http://www.earthobservatory.nasa.gov,global processes atmosphere sensing natural observatory remote hazards nasa cover data blue marble environment maps environmental science volcanoes home climate land earth change warming oceans 
http://www.neb.com,expression sequencing restriction modifying neb enzymes polymerases gene imaging discovery england genome analysis protein competent rna nucleic life acids editing cellssample generation synthetic molecular industry preparation e glycobiology new reagents pcr sciences cells strains coli epigenetics biolabs biology sample science development cell dna next ngs cloning endonucleases prep qpcr leader rtpcr tools 
http://www.linguascope.com,number schools platform language worlds interactive linguascope learning 
http://www.chemguide.co.uk,
http://www.lbl.gov,forbidden 
http://www.ideo.com,global positive ideo company design ideocom impact create 
http://www.sandiegozoo.org,official world diego voted san zoo site 
http://www.niehs.nih.gov,health niehs sciences environmental institute national 
http://www.rea.ru,
http://www.iea.org,world countries energy around policies sustainable agency shape international secure future works iea 
http://www.theiet.org,global community world better inspire uk institution influence engineer iet leading member professional inform technology modern engineering organisation 
http://www.wu.ac.at,wirtschaftsuniversitt wu wien 
http://www.chemicool.com,facts etc online chemical periodic tables winning elements userfriendly videos dictionary table award element data tools cool chemistry 
http://www.jlab.org,lab nature jefferson matter exploring 
http://www.engineersedge.com,engineers edge organization banned 
http://www.audubon.org,birds places habitat society protects guide need today tomorrow field national audubon bird 
http://www.globalsecurity.org,globalsecurityorg 
http://www.cgiar.org,global challenges world poverty humanitys agricultural degradation cgiar worlds largest environmental hunger towards network greatest science innovation free 
http://www.aist.go.jp,aist 
http://www.webqc.org,
http://www.foreignpolicyi.org,relationships interactions state activities objectives one guide foreign policy general states 
http://www.lightningmaps.org,map contributors planet access blitzortungorg lightning maps time thunderstorms across real lightningmapsorg former lightningthunderstormrealtimeblitzortungliveworldwidestrikemapsthundertrackercurrentweatherradardetector see strikes free 
http://www.amnh.org,world year human pm dedicated visit universe natural history institution exploring new nyc york cultures known open city museum days american 
http://www.nrel.gov,home page renewable energy laboratory nrel national 
http://www.biointeractive.org,homepage biointeractive hhmi 
http://www.academicjournals.org,academic home journals 
http://www.lifeprint.com,hand deaf baby signing resources langauge study want dictionary linguistics fingerspell languyage phrases help signs etc students asl hello like printable fun parents aid sign love amslan languages interpreting including alphabet videos good lessons langage people children learn free homeschool fingerspelling culture thank chart selfstudy interpreters language hearing american community materials 
http://www.onlineconversion.com,online else convert anything conversion 
http://www.cybex.in,global derived exports list custom import importers cybex shipment news daily duty policy exporters tax suppliers trade indian reports drawback data major budget buyers trusted houses research statistics media imports dgft cbec hs export code depb notifications firms shipments exim customs service statistical 
http://www.aclweb.org,acl linguistics member association computational portal 
http://www.oceaneering.com,products defense logistics oil entertainment renewable oceaneering needed provide energy engineered oii gas services science next connecting industries whats aerospace 
http://www.mt.com,icin kesfedin laboratuvar cozumlerimizi hemen olcum hassas toledo perakende kantarlar servis aletlerinde terazi mettler urun uygulamalari lideri tartim endustriyel dunya uygulamalariniz 
http://www.ucsusa.org,rigorous problems joining combine practical future analysis create healthy country independent safe across solve concerned union solutions scientists effective people pressing advocacy science technical puts work planets innovative sustainable 
http://www.fws.gov,us fish service wildlife 
http://www.emsc-csem.org,emsc earthquakeearthquake world map todayearthquakes mediterranean todayearth seismological centre europe seismicityseismicseismicityseismicity area quakesreal google magnitude larger events tensorsepicentermagnitudeseismologyforeshockaftershocktremor rest quakeearth recent time provides mapseismologysismologieemsccsemseismicity earthsumatratsunamitsunamismapmapsrichtermercallimoment today real seismic earthquakes latest earthquake european earthquakeearthquakeslast information 
http://www.oceanservice.noaa.gov,intricately el health noaa oceanic nos environment ships boats live reef atlantic surf overseas half noaas southern coral growth atmospheric highways action percent national comes connected la contaminants waves administration indian along volume beach typhoon address arctic services climate navigation tsunami population tools nina congestion healthy threats trade goes coasts science translates coast nations chart economy areas ship nino beaches marine us oceans hurricane economies cyclone towards pacific ocean port boat antarctic working wave seas sea service change coastal 
http://www.zeiss.com,international binoculars medicine zeiss optics leading offers technology internationally optoelectronic industry camera research optical planetariums solutions eyeglass lenses enterprise technologies 
http://www.calculator.com,online anytime problems design math anywhere simply pocket financefractionslove cooking satisfy health calculatorcom calculator tuition college fun solve agriculture curiosity everything converter anything mortgage scientific free running calculators unit loanlease calculate 
http://www.ine.es,este elabora estadstica agency censos espana prices estadisticas national en consumer poblacion el etc contiene fmi difusion cpi servidor poblacin industria lfs cifras de ine viviendas gdp institute ipc productos espaa statistics spain consumo datos nacional demografa general pib instituto municipales estadistica office informacion spanish epa turismo estadsticos distribuye sobre economa sociedad statistical coyuntura precios 
http://www.biospace.com,job home research biotech pharmaceutical biospace find thousands life sciences employers clinical search jobs industry 
http://www.hhmi.org,hhmiorg 
http://www.osti.gov,funded research department tool primary energy office information us hub search technology organizational engineering ostigov science scientific technical 
http://www.biotecnika.org,breaking helps provide biosciences biotech dive biotecnika website latest videos opportunities news career come straight make jobs industry 
http://www.chem4kids.com,ion reaction biochemistry dictionary physical isotope basics compound atoms teaches solid matter raders element mixture chemistry atom acid reactions everyone elements rader chemkids liquid science chemkidscom periodic tutorials table enzyme site 
http://www.alliedelec.com,electronics distributor online control products alliedeleccom electromechanical automation amp electronic million industrial components parts leading allied 
http://www.spaceplace.nasa.gov,short space resources something upperelementaryaged handson place numerous games kids material nasa fun parents awardwinning activities english everyone videos children science home engages website teachers spanish earth interactive articles 
http://www.scienceblogs.com,world scienceblogs discusses science 
http://www.comsol.com,environment engineering multiphysics problems developer simulating interactive modeling software comsol scientific 
http://www.asq.org,global world use make society asq expertise ideas passionate people better certification voice membership leader consists association american tools quality community 
http://www.labroots.com,webinars social news trending connected networking stay top events leading industry educational labroots professionals science scientific free virtual website 
http://www.funbrain.com,online content games ages prek books comics videos educational grade hundreds free check funbrain kindergarten preschool leader interactive education learning kids 
http://www.japanesepod101.com,japanesepod japanese online write study dictionary speaking way community podcasts video fun minutes speak audio read travel lessons fastest easiest start learn culture language learning 
http://www.xlstat.com,microsoft yet share allows analysis addon solution within users leading data excel software analyze powerful flexible customize results xlstat statistical 
http://www.seminarsonly.com,list cse abstracts instrumentation project cseeceitmecheeecivilae pdf chemical students civil applied reports doc seminar technology automobile abstract presentations ideas electronics huge computer electrical mechanical report recent new ece symbosium science topics synopsis ce biotechnology latest ppt telecommunication seminars ee ae engineering information 
http://www.fsis.usda.gov,inspection usda service safety food 
http://www.energystar.gov,moneyclimate years savingsemissions protecting credit homes buildingscertified starhome simple homescertified buildings appliancesenvironment efficient tax productsmost advisorpartner yearlittle star blue changetaxcertified america efficientenergy resource environment save saving energy portfolio greenhouse choice efficiencyenergy efficiency program expertmy appliancesenergy managerwindowsenergystargovrebatesledenergy gasbills auditask labelresource epa 
http://www.coincap.io,market capitalizationbitcoinethereumpricescharts coincapio cryptocurrency cryptocryptocurrencymarket realtime charts trading prices reliable capitalizations cap rankings 
http://www.chemspider.com,providing chemspider fast chemical access share structures million database search associated properties chemistry information structure free 
http://www.careerplanner.com,wall testing personality career use advice jobs assessment planning counselling magazine featured test counseling journaland free fast coach parachute company color tests search change mode street tools information 
http://www.mla.org,study list literature convention job scholars bibliography promotes research format publications style scholarly modern mla home scholarship founded teachers language teaching association information handbook 
http://www.mylanguageexchange.com,language exchange foreign practice learn community languages 
http://www.free-iqtest.net,fast online accurate test iq free 
http://www.fortunejack.com,iletisim teknolojileri kurumu bilgi 
http://www.nfpa.org,nfpa 
http://www.cbd.int,biological home diversity convention 
http://www.mathgoodies.com,helps online resources fifth goodies skills math help middle senior get safe offline resource mathematics basic junior instruction seven grade lessons levels th elementary free child high since eight teaching interactive school class worksheets education secondary learning kids 
http://www.iucn.org,iucn global world measures union nature safeguard conservation international status needed authority natural 
http://www.zamg.ac.at,meteorologie produkte zamg und zentralanstalt fur wetter umwelt geodynamik forschung klima geophysik 
http://www.ipcc.ch,ipcc climate panel intergovernmental change 
http://www.dfg.de,dfg deutsche forschungsgemeinschaft 
http://www.astronomy.com,pluto craft year gravity guide extrasolar skyglow asterism uranus oort gazing heliocentric black jupiter exoplanet adaptation mercury amateur spcae field lunar redshift telescopes lightyear sky microwave neptune meteor archaeoastronomy sapce starchart astrophotography collimation skyguide comets mag belt drift scope blueshift shuttle astronomycom background corona mars esa nova astronomi titan astronomical binoculars atlas quasar watcher astronomie skywatcher object cassegrain go cygni gazer magnitude moon star red glow holes saturn eclipses bang adaption dark radial cosmic hubble astronomy earthshine starlike wants charts missions view eyepiece stargaze andromeda system bolide quasars cmb deep interactive p gaze sunlike celestial solar kuiper news stargazer cosmicray constellation comet astrophysics asteroid transit magazine astronamy venus galaxy method planet stargazing nebula gammaray learn circumpolar amature asteroids big gamma chart zodiac earth spacecraft planets meteors shooting nebulosity nebulae space observing exoplanets kuyper wormhole goto messier sun apparition atmosphere astronomer coordinates astronmy enceladus earthlike quasistellar anyone nasa novae events cassini galaxies hole astromony speed fratio physics constellations eclipse giant conjunction lightspeed telescope pollution finder cosmology astonomy apogee ray protoplanet antimatter light aperture planetarium 
http://www.addgene.org,homepage addgene 
http://www.uofk.edu,khartoum university uofk 
http://www.ucmp.berkeley.edu,paleontology museum university california 
http://www.plymouth.ac.uk,welcome knowledge advancing transforming lives university plymouth 
http://www.sae.org,international sae 
http://www.scientific.net,resources book academic tech ltd scientificnet series field trademark publications peerreviewed largest web science journals trans one publishes engineering materials 
http://www.spaceweather.com,auroras solar spaceweathercom information news meteor flares showers nearearth asteroids 
http://www.convert-me.com,measures online si measurement percent weights area metric pressure cooking weight measurements commonly fractions volume speed units time converter capacity temperature easy conversions quick conversion length calculators mass tables stress chart unit acceleration table used exotic measure currency 
http://www.amara.com,amara furniture worldwide homeware gifting collect find click returns awardwinning delivery decor free home designer available luxury service sunday 
http://www.csiro.au,australian challenges national research agency greatest industrial innovative technology commonwealth australias government csiro solve science organisation scientific 
http://www.perseus.tufts.edu,digital perseus library 
http://www.ms.u-tokyo.ac.jp,home mathematical tokyo sciences university school graduate 
http://www.dadsworksheets.com,expanded subjects delivers tableworksheetsmathcalculatorfractionlong math operationsexpanded chartmultiplication use multiplication standard division divisionmultiplicationdivisionsubtractionadditionorder printable subtraction patterns roman worksheetsmultiplication rounding formstandard fractions including addition charts patternsnumber dadsworksheetscom formroundingnumber number topics home form calculators line thousands variety numerals classroom school order worksheets operations 
http://www.aaas.org,home advancement american association aaas science 
http://www.tu-braunschweig.de,universitt braunschweig technische 
http://www.mathforum.org,
http://www.unitjuggler.com,volume area mass many unit converter easy unitjuggler conversions offers conversion distance free 
http://www.singularityhub.com,along insights hub news follow university delve future technology singularity science 
http://www.edaboard.com,pcb design pld international network softwarecircuitsschematicsbookstheorypapersasicplddspnetworkrfanalog analog electronic designpcbservice manuals rf books electronics dsp electronicselectronic forum circuits papers software theory discussion eda service schematics asic 
http://www.jax.org,global cancer human disease neurobiology jackson empower genomic aging shared cardiovascular quest health discover bioinformatics improve reproductive stem mission genetics biomedical solutions laboratorys cells biology development genomics precise laboratory immunology community 
http://www.math.ucdavis.edu,mathematics home davis uc 
http://www.aip.org,home physics benefit sciences societies advances serves physical humanity promotes institute federation american science 
http://www.nationmaster.com,global market gives trends coverage statistics access nationmaster looking sizing across verticals country industry 
http://www.thorlabs.com,source optical measurement polarization control optics inc fiber thorlabs diodes laser instrumentation 
http://www.anl.gov,national homepage laboratory argonne 
http://www.biologycorner.com,handouts study includes plans students plan student powerpoint presentations resource dissections worksheets lessons biology quizzes learn science investigations teacher teachers laboratory teaching corner labs lesson site 
http://www.ams.org,society american homepage mathematical 
http://www.stat.gov.pl,urzd statystyczny gwny 
http://www.enneagraminstitute.com,institute enneagram 
