Domain,Content
http://www.researchgate.net,research gain connect join access publications visibility find researchgate share million uploading researchers free 
http://www.ncbi.nlm.nih.gov,national biotechnology information center 
http://www.sciencedirect.com,sciencedirect 
http://www.reverso.net,reverso translator online japanese french german reversonet portuguese dictionary spanish hebrew italian dictionaries russian english translation free 
http://www.elsevier.com,gelistirmesi elsevier performansi bilimi kuresel bir sirketi bilgi ilerletmesi yardimci desteklenmesi olan artirmasina sirketidir bilginin analiz sektorunu kuruluslar profesyonellerin saglik 
http://www.coinmarketcap.com,market cryptocurrency coinmarketcap charts capitalizations cap rankings 
http://www.duolingo.com,online french study worlds way duolingo course sciencebased fun popular italian english portuguese duolingocom lessons learn free apps german language spanish flashcards practice 
http://www.timeanddate.com,world online converters year calendars worldwide ipad calendar use pdf calculator meeting find iphone printable windows planner zone date android saving time current best timeanddatecom web services daylight apps clock perpetual countries counters calculators meetings month available 
http://www.autodesk.com,helps autodesk make better world design imagine builds people engineering software construction 
http://www.urbandictionary.com,motherfucker dictionary december impeach urban 
http://www.mayoclinic.org,clinic mayo 
http://www.jstor.org,jstor page primary journals sources loading digital error academic library books 
http://www.ted.com,influential design download subtitles entertainment tech spreading worth business creativity stream technology ideas languages themes talks videos speakers ted science free expert education 
http://www.nature.com,world nature around published discovery journal leading finest multidisciplinary research read peerreviewed first groundbreaking thoughtleaders science decisionmakers drives publishes 
http://www.mathworks.com,matlab develops products supports mathworks sells makers simulink 
http://www.symbolab.com,equation calculator step solver k problems symbolab calculus math trig search precalc solves algebra trigonometry computation 
http://www.weather.gov,national service weather 
http://www.berkeley.edu,berkeley home university california 
http://www.arxiv.org,arxivorg archive eprint 
http://www.howstuffworks.com,illustrations topics conspiracy black theories video thousands everything explains howstuffworks learn flu holes works ranging 
http://www.noaa.gov,department atmospheric administration us national commerce oceanic 
http://www.nationalgeographic.com,world national explore geography history geographic conservation animals civilization technology environment travel people photography cartography science adventure culture exploration leader 
http://www.acs.org,chemical society life american chemistry 
http://www.fao.org,united home organization nations food agriculture 
http://www.livescience.com,environment space culture health history features live mysteries discoveries developments groundbreaking interesting technology science articles 
http://www.colorado.edu,learners human social cu discover scholars potential come solve technological challenges time accelerate humanitarian university bold boulder home innovative community colorado 
http://www.desmos.com,beautiful desmos math free 
http://www.calculatorsoup.com,online math use calculator suggest technology algebra fractions statistics physics new time soup conversions trigonometry finance free calculators build search 
http://www.biomedcentral.com,progress research bmc 
http://www.economist.com,world business politics opinion economics economist insight news international technology authoritative offers connections science finance 
http://www.sciencedaily.com,
http://www.usgs.gov,world changing science usgsgov 
http://www.mdpi.com,open journals access peerreviewed mdpi since publisher establishment 
http://www.bom.gov.au,products weather marine flood observations compiling satellite australian comprehensive access across homepage australias bureau forecasts severe include photos pictures providing australia water meteorology maps also provides charts web radar seas official warnings high responsibility climate information community 
http://www.rsc.org,shaping royal chemical excellence society scientists connecting sciences humanity future benefit chemistry advancing 
http://www.sciencemag.org,aaas science 
http://www.usda.gov,usda 
http://www.jma.go.jp,
http://www.localbitcoins.com,way sell cash transfer get buy safe dollar dealer bank easy pound fastest easiest bitcoins fast local near localbitcoinscom euro 
http://www.apa.org,pardon interruption 
http://www.hse.ru,russia one top hse universities eurasia economics social sciences university leader europe eastern 
http://www.nps.gov,saved special may places park heritage us homepage npsgov service people national american cares experience 
http://www.frontiersin.org,peer news network uptodate academics stay access reviewed across events research articles publications peerreviewed entire frontiers academia scientific open journals openaccess blogs latest publisher spectrum 
http://www.hindawi.com,hindawi 
http://www.he.wikipedia.org,found 
http://www.space.com,space get humanitys expansion ongoing latest astronomy frontier nasa across news final exploration spacecom innovation celebrates 
http://www.italki.com,italki learn online language 
http://www.scientificamerican.com,world understanding articles lives guide news aweinspiring explaining technology change science advances essential american shape information scientific 
http://www.wolfram.com,wolfram knowledge development creators platform language science wolframalpha data systemmodeler meets mathematica finance computation 
http://www.epa.gov,united protection agency epa us environmental states 
http://www.bls.gov,labor agency economics us federal consumer broad cpi figures data stats field bureau ppi statistics rates occupational unemployment compensation productivity jobless outlook employment spending factfinding principal government 
http://www.23andme.com,standards dna directly andme available fda testing includes reports first meet genetic service analysis 
http://www.ssrn.com,home ssrn 
http://www.census.gov,censusgov 
http://www.popularmechanics.com,world inspires master automotive practical help readers whether military popular technology cars breakthroughs computers newest improvement digital information diy mechanics modern science works gadgets influences home latest instructs tools tips homeimprovement 
http://www.phys.org,
http://www.iop.org,home resources physics latest promoting together teaching news developments physicists institute bringing benefit science iop 
http://www.poloniex.com,asset crypto poloniex exchange 
http://www.alldatasheet.com,relay condensor integrated switch module parts manufacturer lamps transformer transistor datasheets pinouts electronic components diode electric inductor diodes sensor capacitor ic part circuits optocoupler datasheet componets free tr engine semiconductors connectorresistors search chip led semiconductorsemiconductors alldatasheetcom site 
http://www.isro.gov.in,space national pursuing aslv dos isro planetary technology harness research irs science development slv india insat exploration pslvgslvgslvmkiii government 
http://www.nist.gov,measurement competitiveness us national economic improve life industrial security technology promotes institute innovation ways science advancing nist standards enhance quality 
http://www.thermofisher.com,global every scienceapplied lab worldwide application sciencesanimal analysisbioproductionhid biologygenetic cited fisher brands offer instrumentsfor life sciencesforensic safetyfood lives healthfood solutionsfrom thermo highquality scientists biologycell sciences essentials science sciencemedical scientific tr believes everyday company transform researchbioprossessingmolecular power innovative support sciencesresearch 
http://www.nhc.noaa.gov,national hurricane center 
http://www.esri.com,esri intelligence esris competitive analytics data businesses technology advantage using gain mapping software learn spatial location powerful available gis 
http://www.aleks.com,arithmetic math individualized business college parents environment preparation instruction evaluation highereducation child cahsee standards accounting prep school adaptive online ap intervention financial remediation aleks based higher tutor assessment principles complete basic statistics educational advanced behind lessons better high k spanish left interactive learning prealgebra testing exit assistant precalculus selfhelp calculus standardsbased report placement trigonometry program homeschooling elementary cycle success education practice developmental geometry help middle objectives automated chemistry algebra homework mathematics fluency physics test provides tutorial web software exam home scores tutoring 
http://www.nap.edu,space public issued economics bookstore social math nap authoritative policy academies national medicine textbooks behavioral nasem health reports security technology education chemistry agriculture environment research physics engineering sciences biology science ethics earth publishes press medical information 
http://www.metric-conversions.org,calculators charts conversion metric 
http://www.metoffice.gov.uk,world public weather uk climate office met leading change services forecasts 
http://www.kraken.com,bitcoin buy cryptocurrency platform trade best exchange place come crypto trading sell learn see kraken 
http://www.sciencealert.com,space trust amazing nature humans sharing news entertainment fascinating tech health technology alert environment pictures research fact physics videos best real analyse genuine bring science scientific check sciencealert inspiring breakthroughs 
http://www.ilo.org,international organization labour 
http://www.r-project.org,r project statistical computing 
http://www.mathworld.wolfram.com,mathematics world wolfram weissteins eric dictionary extensive mathworld webs encyclopedia math erics treasure trove resource 
http://www.technologyreview.com,mission mit conscious betterinformed decisions influential trustworthy authoritative technology journalism bring review 
http://www.nationalinterest.org,
http://www.repec.org,research code including economics repec index papers working software articles central 
http://www.geology.com,geologic worlds news hazards minerals leading careers photos energy maps portals gemstones science volcanoes earthquakes geology geologycom one rocks earth information articles 
http://www.blueletterbible.org,bible study homepages letter blue search tools 
http://www.earthquake.usgs.gov,
http://www.foreignpolicy.com,global news magazine foreign policy ideas 
http://www.arabic-keyboard.org,write board key online editor courses arabic search dont keyboard u 
http://www.sona-systems.com,sona systems cloudbased universities pool subject software 
http://www.popsci.com,space skunks years thats strong news diy homepage projects popular technology primates aweinspiring robots science climates reporting 
http://www.cran.r-project.org,r archive comprehensive network 
http://www.aps.org,organization international physical outreach society advance diffuse activities knowledge research physics working advocacy scientific aps nonprofit home journals meetings membership education american outstanding 
http://www.newscientist.com,space mathematics health physics new astronomy scientist videos news biology technology medicine picture jobs science articles 
http://www.rstudio.com,open source r share scale provides work professional data rstudio teams develop software tools science enterpriseready free 
http://www.algebra.com,tutors math solvers help homework algebra free 
http://www.sigmaaldrich.com,high products sigmaaldrich enable quality improves worldwide life company used leading analytical biology technology services chemistry science materials 
http://www.behindthename.com,world baby popularity around list dictionary encyclopedia etymology name meaning origins get history girl discover find given reference names meanings etymologies ideas behind first origin onomastics boy 
http://www.nejm.org,nejm disease opinion england weekly medicine review clinical journal wide research practice biomedical new science editorial topics importance variety publishes medical general articles 
http://www.cell.com,cell home research trends journals including ajhg current publisher neuron biology press immunity review 
http://www.cointelegraph.com,required attention cloudflare 
http://www.physicsclassroom.com,questions polarization interference reflection problemsolving vectors multimedia mirrors review satellite waves standing behavior optics potential cds conservation planetary motion animations momentum electric charging exercises experiments collisions kinematics kinematic circular gravitation refraction physics energy electrostatics electricity newtons current test resonance circuits tutorial music universal projects projectiles wave lenses answers sound methods static work equations laws color classroom interactive fma light labs practice 
http://www.bps.go.id,website badan pusat statistik 
http://www.rmit.edu.au,melbourne global australia institution rmit design tertiary largest university australias technology 
http://www.undip.ac.id,universitas diponegoro 
http://www.allaboutcircuits.com,every peertopeer discussions day engineers members electronics growing electrical new engineering seeking circuits advanced fastest technical education tools community articles 
http://www.math.lamar.edu,mathematics lamar university 
http://www.gramota.ru,
http://www.ucr.edu,campus diverse mobility social institutions economic powerhouse california within incubator prestigious inclusive knowledge new university system home engine uc ucr one serves riverside 
http://www.iitm.ac.in,research top best india indian iit iitm technology higher madras institute education 
http://www.deakin.edu.au,deakin home 
http://www.faa.gov,department administration aviation us mode operating federal transportation 
http://www.iso.org,standards organization iso publish international standardization develop 
http://www.socalgas.com,home socalgas 
http://www.bitcoin.org,open pp source bitcoin get started new find money know need payment kind bitcoinorg network innovative 
http://www.ranepa.ru,
http://www.ibge.gov.br,portal ibge 
http://www.simplypsychology.org,educators complete students study guides psychology enthusiasts guide simply 
http://www.discovermagazine.com,curiosity everyday discover relevant news feature magazine approachable satisfies photos science articles 
http://www.electronics-tutorials.ws,electronics online basic aspects revision beginners tutorials resource beyond free 
http://www.energy.gov,energy department 
http://www.drugabuse.gov,abuse drug nida institute national 
http://www.ajol.info,ajol online african journals 
http://www.truity.com,truity take find understand tests personality career strengths assessments free 
http://www.jpl.nasa.gov,space pluto voyager jet solar news multimedia universe uranus landing jpl satellite explorer jupiter history robotic moon propulsion nasa mercury flyby orbit leading center technology venus saturn images photos galaxy mission astronomy interactives videos neptune missions stars science asteroids system nasas climate comets laboratory infographics earth spacecraft mars exploration planets 
http://www.mpg.de,startseite maxplanckinstitute der und fur deutschland grundlagenforschung fuhrenden organisationen eine europa maxplanckgesellschaft 
http://www.bitstamp.net,
http://www.esa.int,space astronauts solar human agency station rocket features news international sun probes universe sensing spaceflight comet remote moon launchers venus telecommunications environment monitoring satellites astronomy missions iss galileo science portal system latest european observation navigation ariane exploration mars earth esa education 
http://www.asm.org,world organization specialization outside disciplines educators microbiology division society oldest life members asm scientists microbiological largest today third science united plus one membership grown single represent american located states 
http://www.nobelprize.org,official nobel prize website nobelprizeorg 
http://www.sciencenews.org,disciplines archives back articles latest well stories reviews features news feature daily magazine science areas 
http://www.gallica.bnf.fr,livres affiches epubs gratuit de presse sonores estampes documents gallica fascicules manuscrits et tlchargeables gratuitement partitions consultables plusieurs journaux cartes revues photographies enregistrements millions plans 
http://www.cern.ch,lhc world organization made nuclear particles fundamental universe business respected hadron large cern research physics largest science works scientific home collider finding centres european one highenergy 
http://www.bitcoin.com,btc bitcoin fees download news prices buy using bch read bitcoincom digital bank today start private free official money app mining wallet instant 
http://www.bitpay.com,welcome payments bitcoin today store future card bitpay start wallet accepting spend 
http://www.purplemath.com,informal succeed home get questions concept math lessons purplemath practical help provided learn lesson algebra 
http://www.imd.gov.in,weather imd tourism seismo delhi cyclone forecast climatological meteorological mausam climatology extreme data department meteoroglogy earthquake city india tsunami 
http://www.eurekalert.org,space online universities social news archaeology embargoed medicine institutions grants health society leading technology education chemistry agriculture books environment research press featuring headlines physics astronomy biology awards science experts geology releases meetings eurekalert sponsored service engineering aaas medical 
http://www.thecalculatorsite.com,online converters multitude around math based calculations cooking health calculator areas large using resource range quick science finance free calculators site 
http://www.nxp.com,fueling microcontroller automotive networking consumer analog socs processors ics industrial security rf nxp connectivity iot innovation dsp solutions digital signal processing management microcontrollers sensors semiconductors applications power technologies 
http://www.atago.net,slides world constantly lab battery made share oil brix parts atago salinity factories inspection abbe worked coltd electronic meter developed inception market assembling optical refractometer coolant time circuits first analyticalc polarimeter nd japan petroleum lenses overseas domestic adjustment apparatus processing metal consistently ri laboratory since viscosity saltmeter handheld sticking saccharimeter wine 
http://www.statcan.gc.ca,agency canadian census recensement dli social le national economic la lconomie canada du fournit sur de statcan data cansim statistique industry des lindustrie statscan research statistics conomie donnes canadienne provides et canadas organisme papers socit labour economy population statistical statistiques 
http://www.iaea.org,nuclear agency worlds centre international secure safety peace use atoms nonproliferation protection health atomic radwaste safe vienna cooperation security generation technology field food atom agriculture wide range energy including iaea environmental radiation development works united nations peaceful promoting un safeguards areas 
http://www.eia.gov,energy administration us eia information 
http://www.sciencebuddies.org,ask fair project step ideas board fairs projects selection science topic free answers expert discussion success wizard tools tips experiment 
http://www.minitab.com,process improvement data statistical analysis minitab tools 
http://www.fcc.gov,united commission federal communications america states 
http://www.lingq.com,global japanese online french content interesting ios listen extension russian english languages android read portuguese enjoyably authentic web anything learn lingq korean german chinese app spanish vocabulary grow chrome community 
http://www.osha.gov,home health administration occupational safety 
http://www.mnn.com,mnn source responsibility nature living conservation mother worlds social environmental news leading network advice information sustainable 
http://www.nips.cc,website conference neurips 
http://www.doaj.org,directory open online doaj journals access peerreviewed provides quality indexes 
http://www.universetoday.com,temporarily service unavailable 
http://www.engineering.com,engineers inspiration information engineeringcom 
http://www.adsabs.harvard.edu,streamlined powerful nasaads new astrophysics data system 
http://www.thatquiz.org,exam thatquiz teacher students student teachers test math free grade tests levels quizzes class practice activities quiz 
http://www.stata.com,timeseries graph reproducible dataset analysis make stata explore collect solution applied reports inferences data series manipulate needs statistics time visualize model software science management obtain package results statistical 
http://www.scielo.org,virtual bvs e scieloorg bibliografia conhecimento ciencia biblioteca sade informaco bireme 
http://www.webmath.com,forms geometry possible problems arithmetic adding math help converting webmath analysis subtracting dividing calculating lines numbers solution calculus data returns solve multiplying complex polynomials algebra graphing fractions statistics stepbystep provides designed covers problem conversion fillin finding factoring simplifying cosmeo composed 
http://www.mathopenref.com,open math table reference contents 
http://www.ansys.com,comprehensive solutions delivers simulation design scalability multiphysics pervasive foundation product unmatched engineering software modeling ansys 
http://www.arborday.org,kits online tree give gift visit make usa day forest buy coffee curriculum caring difference america growing planting shade rescue provides foundation rain conferences learn trees free fast official nursery programs pruning arbor city grown memory much care site information kids 
http://www.opticsplanet.com,eyewear hunting tactical binoculars scopes opticsplanetcom dot optics like riflescopes red night ban gear microscopes telescopes premium blackhawk rangefinders sights trijicon ray hobbies discounts work vision eotech sunglasses shooting deals 
http://www.math.com,maths tesellation world divide problems math converting tessellation division fractal square parents prime polygon multiply fraction decimal free homeschool beyond probability pi ratio online mathematical measurement percent statistic multiplication area quadratic mathmagic equation solve fractol volume triangle statistics basic anxiety everyone converter lessons theorem number unit circle mental pythagorean instantly mathcom prealgebra formula convert history students perimeter calculus units solutions puzzles trigonometry problem conversion word teachers measure mathematician resources geometry teselation help games calculating calculator numbers find algebra homework mathematics fractions magic tesselation equations trapezoid change calculate 
http://www.cfd-online.com,page http server test powered centos apache 
http://www.airnow.gov,dataparticlepmepaenvironmental action agencyenviroflashair mapsmappingozone camsmonitoringreal levelairpolutionforecastingforecastprograms protection ozone email airnowair qualityoaroaqpspollutantair maps time indexaqiozonepollutionozone dayssmogvisibilitypeak web pollution forecastsair pollutionair particle airnow quality animationozone 
http://www.abs.gov.au,australian government statistics bureau 
http://www.climate.nasa.gov,satisfied request error could 
http://www.ewg.org,moment 
http://www.genetics.utah.edu,institute eccles human genetics 
http://www.cas.cz,neuniverzitn instituce vvoj esk akademie vzkumn republiky vda vd vdec vzkum veejn 
http://www.crypto.com,payments bitcoin btc pioneering perfect cryptocurrency ethereum anywhere allows sell indextitle mco buy cryptocurrencies crypto cashback ltc visa rates platform exchange interbank cryptocom track card send app litecoin eth wallet spend 
http://www.cirad.fr,accs interdit 
http://www.rand.org,helps public years focuses human defense worlds international preeminent policy objective national analysis debate decisionmaking health corporation institution independent improve matter affairs business security tank technology law homeland agenda environment consisting research knowledge energy staff boundaries provides minds services domestic science development expanding experts nonprofit terrorism rand think issues education 
http://www.derivative-calculator.net,online derivatives derivative differentiation calculator step solution stepbystep included steps solve function graphs using free 
http://www.gks.ru,
http://www.ucar.edu,atmospheric research university corporation 
http://www.itu.int,world itu union committed connecting telecommunication international 
http://www.r-bloggers.com,write year bloggers super assignments consulting ive news link lobster managed last r find anyone algorithmicelectronic across came hours busy workload contributed rbloggers new asks great hundreds working heavy tool still tutorials since post trading 
http://www.defense.gov,us department defense 
