Domain,Content
http://www.cabdirect.org,global bibliographic incorporating databaseglobal abstracts databases health cab life applied reference leading source platform sciences direct sciencesabstracts thorough extensive directagriculturelife 
http://www.jove.com,watch peer physical chemical video protocols reviewed journal jove research peerreviewed videos accelerate biological science scientific methods publishes medical experiment articles 
http://www.genecards.org,
http://www.ametsoc.org,home society atmospheric related hydrologic sciences meteorological oceanic information promotes education american development dissemination 
http://www.scb.se,konsumentprisindex statistiska statistikmyndigheten om bnp myndighet import inflation befolkning en r exempel fram omrden arbetsmarknad producerar tar som officiell export sverige vi och centralbyrn statistik p scb 
http://www.biolegend.com,homepage biolegend 
http://www.citypopulation.de,map world cities administrative leading large inhabitants major biggest statistics divisions maps agglomerations largest charts countries city population principal 
http://www.cloudynights.com,cloudy home nights 
http://www.numberempire.com,forbidden 
http://www.weizmann.ac.il,world daniel institutions natural initially sieff weizmann leading rebecca institute south multidisciplinary renamed research basic dr sciences son rehovot science aviv israel tel london memory established one exact chaim located 
http://www.nationaltrust.org.uk,houses trust home countryside places join protect gardens coast us look buildings help national love 
http://www.media.mit.edu,updates research mit mixing lab media seemingly interdisciplinary matching news areas encourages disparate unconventional 
http://www.ustr.gov,united home trade states representative 
http://www.bio-rad.com,range research products processing services diagnostics life biorad clinical biopharmaceutical offers education food science 
http://www.soas.ac.uk,global study worlds asian studies middle africa institution mena leading soas east african china university asia japan london india oriental school eastern 
http://www.quickmath.com,problems math allows quickmath matrices mathmathematicstutoringcalculusalgebramatricesmatrixdifferentiateintegrateinequalitiesequationssolvesolvingfactorfactoringsimplifysimplifyingexpandexpandinglessonshelpinteractivefreehomeworkkidsexampleproblemsolutionsolvingreviewwebgeneraleducationalteachinglearninginstructionschoolautomaticinstantonlineonlinestrategiessoftwaresharewarepuzzlesgames get students equation calculus algebra solutions solver stepbystep solving problem kinds right instant 
http://www.humanmetrics.com,online attitude entrepreneur building fortune human testing morals personality career hr compatibility team visionary relationships provider risktaking briggs solution jung business dating role center romance mating matchmaking humanmetrics love myers partnership small assertiveness test personal model entrepreneurship traits focused leadership politics success franchise tests fate lifestyle marriage 
http://www.intellicast.com,underground intellicast weather 
http://www.me.umn.edu,home department mechanical engineering u 
http://www.opendemocracy.net,home opendemocracy 
http://www.nikon.com,nikon global home website 
http://www.cpc.ncep.noaa.gov,climate prediction center 
http://www.nsta.org,national science teaching association 
http://www.spc.noaa.gov,noaanws storm prediction center 
http://www.iucnredlist.org,looking exist page doesnt 
http://www.ntust.edu.tw,title 
http://www.nature.org,forests world agricultural nature mitigation conserve design ecosystems plant freshwater protected social prairie sensing butterfly health behavior emissions engagement anthropology adaptation optimal aquaculture peoples fulfill enrich aquatic boreal resource coastal lakes communities ability systems biodiversity great biology reef phenology decision oyster investment coral information investing economics resilience policy avian planning depends conservation restoration security rivers fisheries needs source statistics water landscape hydropower distribution services urban development siting climate local sake land removals vision population reduction sustainable migration public act bioacoustics estuarine reefs species use cities healthy synthesis partnerships diversity thrives protect forest protection funds geographic lands acidification disaster flux agriculture oceanography migratory monitoring mission solutions energy fire islands waters modelling private ghg science songbird management spatial sustainability wildlife forestry socioeconomics indigenous valuing quality watershed areas infrastructure terrestrial human marine soil ecosystem carbon welfare natural benefits community remote well interdisciplinary return life lives ecology grassland food pacific ocean modeling provide invasive habitat genetics scientists risk markets environmental conservancy sustainably people biological redd finance ecological strategies wetland cycling nonparametric lead change metaanalysis rare natures equity 
http://www.alltransistors.com,cross reference database search transistors datasheet transistor 
http://www.history.org,citizenship resources gardens jefferson savers trips screen multimedia dewitt visit idea buildings eighteenthcentury studies kids page drums history podcasts webcam martha donate electronic bassett hall washington journal virginia field clothing america zone revolutionary patrick thomas african fifes puzzles foundation wallace museums colonial jigsaw children official home foundations teacher trades architectural george historyorg historic city museum tickets williamsburg henry hotels plans education american lesson site 
http://www.math.ubc.ca,welcome 
http://www.evolution.berkeley.edu,evolution understanding 
http://www.grist.org,burn planet future toward working suck grist 
http://www.cadence.com,world products design delivering help provider electronic cadence leading great software ip system soc connect automation build eda chip tools intelligent 
http://www.datasheet4u.com,dataheetu datasheetucom pdf semiconductor rated search offers datasheet site 
http://www.qiagen.com,insight qiagen sample 
http://www.flysat.com,home chart flysat satellite 
http://www.cellsalive.com,aids study microscopy mobilefriendly use microbiology students video animations resource puzzles cells biology quizzes provided cell since immunology interactive alive learning 
http://www.artic.edu,located park tripadvisors chicago top art museum chicagos must city attractiona institute downtown millennium visiting 
http://www.aiaa.org,corporate space world defense brings nearly individual society advance members institute industry largest science academia technical home countries aviation together aiaa engineering government aerospace astronautics 
http://www.zmescience.com,research zme latest exactly rocket features news daily publishes technology science 
http://www.onlinestatbook.com,book statistics free 
http://www.bfs.admin.ch,bundesamt kompetenzzentrum der offentlichen fur ist das schweiz statistik nationale 
http://www.dlr.de,raumfahrt deutsche sicherheit und ev dlr startseite bundesrepublik luft das energietechnik grundlagenforschung zentrum fur portal luftfahrt der deutschland ist forschungszentrum 
http://www.agu.org,welcome space agu nonprofit mission whose promote discovery international earth association humanity science benefit advancing scientific 
http://www.maa.org,homepage mathematical america association 
http://www.seti.org,gone 
http://www.mathportal.org,linear calculators geometry calculus math lessons tests analytic help homework algebra formulas free 
http://www.iisd.org,champions world knowledge act iisd solutions independent problems think international tank institute pressing development sustainable 
http://www.windows2universe.org,space resources sun universe connections differentiated explore humanities video related mythology windows activities images english astronomy interactives sciences stars arts teacher moons spanish classroom earth planets learning 
http://www.informs.org,informs home research management decision analysis analytics simulation sciences iol marketing institute operations modeling science 
http://www.math.uh.edu,houston mathematics department university 
http://www.webelements.com,tableau tavola tabla webelements systeem chemical periodensystem atomic weight chemistry homework priodique elements periodica science periodiek periodic chart peridica table periodicity 
http://www.innerbody.com,turn home dna health metals innerbody find test best testing std ancestry cover help heavy experts 
http://www.mindat.org,mines minerals mindatorg 
http://www.bibliotecapleyades.net,inicio 
http://www.citizensinformation.ie,citizens information 
http://www.nrc.gov,environment home page nrc protecting commission nuclear people regulatory 
http://www.mathoverflow.net,qa professional mathematicians mathoverflow 
http://www.betterexplained.com,click lessons math betterexplained 
http://www.ifc.org,
http://www.infn.it,fisica istituto nazionale di nucleare 
http://www.lawlessfrench.com,resources french study reading else lawless laura need exercises full everything lessons quizzes learn free comprehension listening k tips site 
http://www.carolina.com,supplies educators stem years world curriculum around supprt laboratory classroom offers biological use chemistry science carolina materials provided 
http://www.chemie.de,alle labor und ihnen news informationen prozess inhalte bundelt aktuellen bis themen branchenrelevanten von analytik das fachinformationen zu informationsportal vom bietet produkten zum rund sie fur uber labortechnik um verfahrenstechnik innovativen chemie anlagenbau chemiede umfassenden dienstleistungen prozesstechnik fachportal 
http://www.cabi.org,organization worldwide problems international intergovernmental lives expertise solve cabi agriculture applying providing environment improves cabiorg people scientific notforprofit home information 
http://www.econpapers.repec.org,econpapers 
http://www.escholarship.org,escholarship 
http://www.cosmosmagazine.com,pictures makes founded finkel latest beautiful scientist accessible everything chief alan everyone great magazine discoveries australias science cosmos 
http://www.chemicalaid.com,get using calculators problems easily elements solvers solve chemistry information detailed chemicals 
http://www.itri.org.tw,
http://www.science.nasa.gov,directorate mission science 
http://www.viacharacter.org,know personality empowered fulfilled goals assessment take discover feel profile life face reports professionally personally institute toward challenges test today survey development strengths free character work via 
http://www.extension.psu.edu,trust cooperative delivers dairy crops safety natural forest renewable business pennsylvania beef food extension agriculture water energy university gas penn nutrition management park state education 
http://www.dnvgl.com,environment dnv sustainability safer smarter safeguarding business advance property life purpose organizations greener enables safety gl dnvglcom driven 
http://www.botanical-online.com,botanicalonline las de mundo plantas el 
http://www.circuitstoday.com,design feature simple diagramselectronic students hobbyists understand electronic hobby resource electronics circuit providing educational circuits authentic diagrams projects free tutorials since engineering alike materials 
http://www.ssb.no,statistikk statistisk sentralbyr ssb forside dekke om har behovet samfunnet hovedansvaret det norske 
http://www.scitechdaily.com,space scitechdaily news technology science 
http://www.ecsdl.org,society electrochemical 
http://www.nrcs.usda.gov,home nrcs 
http://www.carnegieendowment.org,carnegie endowment international peace 
http://www.norwich.edu,online birthplace norwich us professional senior oldest military college rotc offering degrees vermont university northfield private graduate united undergraduate education states 
http://www.originlab.com,graphing physics psbfpyajjqwitdrkqpzkpartfw origin originlab data originpro analysis software science 
http://www.bea.gov,bea us analysis economic bureau 
http://www.aiche.org,aiche 
http://www.nibib.nih.gov,focused biomedical health improve part bioengineering imaging institute national creating technologies nih 
http://www.cemc.uwaterloo.ca,mathematics computer organization cemc become largest recognized science canadas outreach promoting creating activities materials 
http://www.science.gov,defense gateway us agencies medicine federal technology chemistry agriculture environment usagov research physics energy including astronomy sciencegov biology provided science development portal results information government 
http://www.vvsu.ru,
http://www.labarchives.com,online enable lab store notebook publish electronic data research labarchives product organize software scientific home eln cloudbased laboratory patent notebooks innovative researchers 
http://www.spie.org,biophotonics imaging dedicated international society optics homepage education research publications conferences advancing scientific tradeshow nonprofit photonics applications spie laser engineering conference programs 
http://www.oceana.org,oceana oceans protecting worlds 
http://www.hashcat.net,intel cracker cracking recovery hashcat worlds advanced gpu password amd nvidia fastest utility fpga cuda opencl cpu 
http://www.aaamath.com,skillsaddition aaa unlimited concepts arithmetic percent math features place allows multiplication graphs consumer comprehensive interactivemath division numbers subtraction patterns fractions statistics mastery lessons ratiosmeasuringmoneyexponentsdecimalsequationsgeometryalgebrapractical naming topic set available estimation thorough value interactive practice mental 
http://www.digital-kaos.co.uk,dbox specialists technomate kaos starview keys hack softcam cable digital eurovox iptv technology dreambox satellite cccam 
http://www.environment.gov.au,environment australian home protect department designs water energy implements policies conserve heritage climate action promote government programmes 
http://www.cshl.edu,cancer plant neuroscience institution bioinformatics laboratorya spring research biology frontiers private harbor advancing notforprofit genomics cold laboratory education programs 
http://www.lanl.gov,home page lab alamos security national science los 
http://www.odi.org,global thrives world every odi person independent evidence peaceful think vision tank change institute ideas development sustainable overseas 
http://www.3dsystems.com,comprehensive products print solutions including systems manufacturing provides ondemand printers healthcare services software scanning materials 
http://www.city-journal.org,public online conservative mix policy premier stimulating seek affairs journal magazine practicality hardheaded journalists cuttingedge urban theory city officials 
http://www.psychologicalscience.org,aps nonprofit organization advancement psychology level dedicated international association national psychological science scientific representation 
http://www.umt.edu,educators globe students around thrive place across come university missoula toptier montana researchers country located 
http://www.econlib.org,forbidden 
http://www.theanalysisfactor.com,resources statistics consulting workshops factor statistical analysis researchers 
http://www.wikicfp.com,intelligence book wikicfp calls international networking communications etc events wiki computer artificial systems chapters conferences papers software science signal processing journals meetings website workshops cfp seminars machine engineering call learning 
http://www.mathnasium.com,centers problems skills math help tutor helping develop offer center mathnasium homework lessons services learn customized grades k tutorials learning kids tutoring 
http://www.horiba.com,worldwide process automotive invitro instruments broad rd semiconductor horiba measurements ranging welcome range monitoring companies metrology horibacompanyautomotivemiramedicalsemiconductorscientificprocessenvironmentalwater systems manufacturing provides environmental scientific diagnostics applications group extensive array qc medical 
http://www.earth911.com,forbidden 
http://www.governing.com,governing state local nonpartisan provides insight news analysis government 
http://www.machinedesign.com,stackpath 
http://www.electrum.org,wallet bitcoin electrum 
http://www.mikeholt.com,years based us career visit options use explore take enterprises expertise inhouse mike training continuing preparation electrical solutions holt companies easy effective level code exam next powerful schools apprenticeship individuals education 
http://www.dreammoods.com,online z dictionary dictionaryforumsmeanings interpretations visionsfree guide help fascinating interpret readerdreamdictionaryinterpinterpredreemdreme meanings source forums dreaming analysisspiritual dream interpretationdream moods interpretation suenos free check word topics dreamsinterepretationintirpretationdremasdreemesreadings discussion dreams views dictionarysleepdream 
http://www.prb.org,advance empower reference inform population bureau 
http://www.ukrstat.gov.ua,
http://www.mylanguages.org,japanese thai french dutch iraqi norwegian danish tagalog quizes malay arabic hungarian swedish hindi phrases polish lithuanian brazilian ukrainian turkish albanian vietnamese slovene greek bulgarian catalan zulu enjoy finnish offers italian russian swahili languages yiddish irish portuguese mandarin latvian indonesian czech afrikaans filipino lessons hebrew welsh haitian serbian learn esperanto romanian free galician korean grammar slovak german website farsi chinese spanish icelandic maltese croatian vocabulary estonian macedonian learning learnign 
http://www.gsi.de,aktuelles gsi 
http://www.anton-paar.com,surface viscometer analysis density synthesis instruments paar meter measuring sensor industry preparation research produces highquality refractometer analyzer velocity microwave inline anton polarimeter beverage sample home antonpaarcom saxs sound sugar gmbh rheometer co 
http://www.math.tamu.edu,mathematics research department math university tamu education texas 
http://www.eea.europa.eu,environment home page developing adopting public also european agency environmental involved general policy implementing agencys information evaluating 
http://www.segway.com,home segway 
http://www.datasheetarchive.com,datasheets engine notes application electronic million sheet component archive components data search datasheet manufacturers 
http://www.virginiasafaripark.com,home park virginia safari 
http://www.maplesoft.com,mathematics maplesoft online services stem education math providers engineering software learning 
http://www.electronicdesign.com,stackpath 
http://www.iris.edu,facilities earthquakes management seismology operation dmc consortium seismological universities distribution dedicated data acquisition iris science 
http://www.math.ucla.edu,mathematics department ucla 
http://www.biocompare.com,technological products read hear scientists biocompare find life latest reviews guide developments buyers 
http://www.handspeak.com,handspeak asl dictionary language sign 
